10/08/2015,1255,sit amet sapien dignissim vestibulum vestibulum ante ipsum primis in
03/21/2021,5941,proin risus praesent lectus vestibulum quam sapien varius ut blandit non interdum in ante vestibulum ante ipsum
01/24/2020,7318,suspendisse ornare consequat lectus in est risus auctor sed tristique in tempus sit amet sem fusce
05/15/2017,4606,in blandit ultrices enim lorem ipsum dolor sit amet consectetuer adipiscing elit proin interdum mauris non ligula
07/19/2017,8883,aenean lectus pellentesque eget nunc donec quis orci eget orci vehicula condimentum curabitur in libero
04/01/2018,465,leo rhoncus sed vestibulum sit amet cursus id turpis integer aliquet massa id lobortis convallis tortor risus dapibus
08/29/2018,4688,ac nulla sed vel enim sit amet nunc viverra dapibus nulla suscipit ligula in lacus
08/20/2019,8596,nisl nunc rhoncus dui vel sem sed sagittis nam congue risus semper porta volutpat quam
03/23/2018,3138,morbi vel lectus in quam fringilla rhoncus mauris enim leo rhoncus sed vestibulum sit amet cursus id turpis integer aliquet
03/10/2021,9554,vulputate luctus cum sociis natoque penatibus et magnis dis parturient montes nascetur
04/07/2020,6899,quis turpis eget elit sodales scelerisque mauris sit amet eros suspendisse accumsan tortor quis turpis sed ante
01/01/2015,3311,sed sagittis nam congue risus semper porta volutpat quam pede lobortis ligula sit amet eleifend pede libero
10/17/2016,6022,justo pellentesque viverra pede ac diam cras pellentesque volutpat dui maecenas tristique est et tempus semper est quam pharetra
03/22/2018,4801,nisi venenatis tristique fusce congue diam id ornare imperdiet sapien urna pretium nisl ut
03/09/2015,3387,blandit mi in porttitor pede justo eu massa donec dapibus duis at velit
09/07/2021,2669,eu massa donec dapibus duis at velit eu est congue elementum in hac
12/13/2016,9030,urna pretium nisl ut volutpat sapien arcu sed augue aliquam erat volutpat in congue etiam justo etiam pretium iaculis
03/14/2016,2201,eu mi nulla ac enim in tempor turpis nec euismod scelerisque quam turpis
01/27/2021,1969,nulla suscipit ligula in lacus curabitur at ipsum ac tellus semper interdum mauris ullamcorper purus sit amet nulla
04/26/2018,8284,ipsum primis in faucibus orci luctus et ultrices posuere cubilia curae nulla dapibus
01/25/2016,5089,turpis a pede posuere nonummy integer non velit donec diam neque vestibulum eget vulputate ut ultrices vel augue
06/16/2021,2156,nullam varius nulla facilisi cras non velit nec nisi vulputate nonummy
03/18/2018,5738,molestie lorem quisque ut erat curabitur gravida nisi at nibh in hac habitasse
07/24/2016,3072,eu interdum eu tincidunt in leo maecenas pulvinar lobortis est phasellus sit amet erat nulla tempus vivamus in
05/12/2016,9686,id consequat in consequat ut nulla sed accumsan felis ut at dolor quis odio consequat varius integer ac
03/26/2015,5261,non ligula pellentesque ultrices phasellus id sapien in sapien iaculis congue vivamus metus arcu adipiscing molestie hendrerit
12/18/2016,7903,venenatis turpis enim blandit mi in porttitor pede justo eu massa donec dapibus duis at velit eu
05/24/2016,5087,dignissim vestibulum vestibulum ante ipsum primis in faucibus orci luctus et ultrices
01/23/2019,2887,ante ipsum primis in faucibus orci luctus et ultrices posuere cubilia curae
08/09/2016,301,turpis elementum ligula vehicula consequat morbi a ipsum integer a nibh
01/15/2020,8006,nulla ut erat id mauris vulputate elementum nullam varius nulla facilisi cras non velit nec nisi
12/22/2017,4213,adipiscing elit proin risus praesent lectus vestibulum quam sapien varius ut blandit non interdum in ante vestibulum ante ipsum
05/24/2015,4675,ligula vehicula consequat morbi a ipsum integer a nibh in quis justo
12/28/2019,9199,ut erat curabitur gravida nisi at nibh in hac habitasse platea dictumst aliquam augue quam sollicitudin vitae
05/04/2021,1126,nibh quisque id justo sit amet sapien dignissim vestibulum vestibulum ante ipsum
08/17/2018,6374,curae nulla dapibus dolor vel est donec odio justo sollicitudin ut suscipit a feugiat et eros vestibulum
04/21/2019,2149,lacus morbi quis tortor id nulla ultrices aliquet maecenas leo odio condimentum id luctus nec
04/07/2020,3460,curabitur at ipsum ac tellus semper interdum mauris ullamcorper purus sit amet nulla quisque arcu libero rutrum ac lobortis
05/24/2019,9997,sapien sapien non mi integer ac neque duis bibendum morbi non quam nec dui luctus rutrum
08/02/2020,7074,bibendum imperdiet nullam orci pede venenatis non sodales sed tincidunt eu felis fusce posuere felis sed lacus morbi sem
06/08/2016,403,molestie lorem quisque ut erat curabitur gravida nisi at nibh in
09/30/2018,316,venenatis tristique fusce congue diam id ornare imperdiet sapien urna pretium
05/02/2015,5011,amet erat nulla tempus vivamus in felis eu sapien cursus vestibulum proin eu mi nulla ac enim in tempor
10/03/2019,7781,quam a odio in hac habitasse platea dictumst maecenas ut massa quis augue luctus tincidunt nulla mollis
05/30/2018,3362,sed ante vivamus tortor duis mattis egestas metus aenean fermentum donec
01/06/2017,1517,nisi eu orci mauris lacinia sapien quis libero nullam sit amet turpis elementum ligula vehicula
09/26/2015,5049,vehicula consequat morbi a ipsum integer a nibh in quis justo maecenas rhoncus
02/08/2018,4287,sapien dignissim vestibulum vestibulum ante ipsum primis in faucibus orci luctus et ultrices
04/15/2019,7583,leo rhoncus sed vestibulum sit amet cursus id turpis integer aliquet
11/22/2020,765,erat volutpat in congue etiam justo etiam pretium iaculis justo
12/05/2019,5679,feugiat non pretium quis lectus suspendisse potenti in eleifend quam a odio in hac habitasse
11/21/2017,9504,primis in faucibus orci luctus et ultrices posuere cubilia curae duis faucibus accumsan odio curabitur convallis duis consequat dui
07/21/2017,8653,ante ipsum primis in faucibus orci luctus et ultrices posuere cubilia curae mauris viverra diam
05/14/2016,6455,luctus cum sociis natoque penatibus et magnis dis parturient montes nascetur ridiculus mus vivamus vestibulum sagittis sapien cum sociis
08/20/2016,7911,magna vulputate luctus cum sociis natoque penatibus et magnis dis parturient montes nascetur ridiculus mus
10/29/2015,8839,blandit lacinia erat vestibulum sed magna at nunc commodo placerat praesent blandit nam nulla integer pede justo lacinia eget tincidunt
05/05/2017,616,pede ac diam cras pellentesque volutpat dui maecenas tristique est et tempus semper est quam pharetra magna ac consequat metus
11/23/2019,6284,pellentesque volutpat dui maecenas tristique est et tempus semper est quam pharetra magna
02/27/2020,9125,vivamus vel nulla eget eros elementum pellentesque quisque porta volutpat erat quisque erat eros viverra eget congue eget semper
04/09/2021,1469,felis eu sapien cursus vestibulum proin eu mi nulla ac enim in tempor turpis nec euismod
11/01/2018,9970,primis in faucibus orci luctus et ultrices posuere cubilia curae nulla
04/22/2018,3017,mattis pulvinar nulla pede ullamcorper augue a suscipit nulla elit ac nulla
02/03/2019,2535,maecenas tincidunt lacus at velit vivamus vel nulla eget eros elementum pellentesque quisque porta volutpat erat quisque erat
05/09/2015,8866,massa id lobortis convallis tortor risus dapibus augue vel accumsan tellus nisi eu orci mauris lacinia sapien
09/24/2018,6341,nulla mollis molestie lorem quisque ut erat curabitur gravida nisi at nibh in
02/07/2021,543,gravida nisi at nibh in hac habitasse platea dictumst aliquam augue quam
04/22/2017,8814,eget orci vehicula condimentum curabitur in libero ut massa volutpat convallis morbi odio odio elementum eu interdum eu tincidunt in
12/19/2017,5907,curae duis faucibus accumsan odio curabitur convallis duis consequat dui nec nisi volutpat
10/25/2021,5445,laoreet ut rhoncus aliquet pulvinar sed nisl nunc rhoncus dui vel sem sed sagittis nam congue risus
10/26/2020,3972,est phasellus sit amet erat nulla tempus vivamus in felis eu
08/06/2017,5890,platea dictumst etiam faucibus cursus urna ut tellus nulla ut
02/22/2017,5562,eu nibh quisque id justo sit amet sapien dignissim vestibulum vestibulum ante ipsum primis in faucibus orci luctus et ultrices
10/03/2019,106,nunc purus phasellus in felis donec semper sapien a libero nam dui proin leo odio porttitor id consequat
04/08/2019,5507,ultrices mattis odio donec vitae nisi nam ultrices libero non mattis pulvinar
11/05/2016,8043,pede posuere nonummy integer non velit donec diam neque vestibulum eget vulputate ut ultrices vel augue
08/21/2015,7559,in faucibus orci luctus et ultrices posuere cubilia curae donec pharetra magna vestibulum aliquet ultrices erat tortor sollicitudin
12/05/2021,5477,volutpat dui maecenas tristique est et tempus semper est quam
07/20/2015,3315,aenean fermentum donec ut mauris eget massa tempor convallis nulla neque libero convallis eget
02/27/2021,9217,volutpat quam pede lobortis ligula sit amet eleifend pede libero quis orci nullam molestie nibh in lectus pellentesque
10/04/2019,1575,elit proin interdum mauris non ligula pellentesque ultrices phasellus id sapien in sapien iaculis congue vivamus
05/03/2021,7029,mauris enim leo rhoncus sed vestibulum sit amet cursus id turpis
04/26/2016,8728,porta volutpat erat quisque erat eros viverra eget congue eget semper rutrum nulla
05/27/2020,7414,platea dictumst etiam faucibus cursus urna ut tellus nulla ut erat id
09/26/2020,642,mattis odio donec vitae nisi nam ultrices libero non mattis pulvinar nulla pede ullamcorper augue a suscipit nulla elit
06/16/2015,4042,augue a suscipit nulla elit ac nulla sed vel enim sit amet nunc viverra
02/01/2021,5497,diam neque vestibulum eget vulputate ut ultrices vel augue vestibulum ante ipsum
09/08/2017,361,lorem ipsum dolor sit amet consectetuer adipiscing elit proin risus
03/05/2018,4401,risus dapibus augue vel accumsan tellus nisi eu orci mauris
12/04/2017,5955,elit proin risus praesent lectus vestibulum quam sapien varius ut blandit non interdum in ante vestibulum ante ipsum
11/16/2019,1954,ipsum primis in faucibus orci luctus et ultrices posuere cubilia curae nulla dapibus dolor vel est donec odio justo sollicitudin
09/15/2018,9870,diam erat fermentum justo nec condimentum neque sapien placerat ante
07/12/2016,6482,a suscipit nulla elit ac nulla sed vel enim sit amet nunc viverra dapibus
11/02/2019,3128,dapibus nulla suscipit ligula in lacus curabitur at ipsum ac tellus semper interdum mauris ullamcorper purus
08/20/2016,569,at nibh in hac habitasse platea dictumst aliquam augue quam sollicitudin vitae consectetuer eget rutrum at
07/02/2021,7646,leo odio condimentum id luctus nec molestie sed justo pellentesque viverra pede ac diam cras pellentesque volutpat dui maecenas tristique
11/24/2018,6302,pellentesque volutpat dui maecenas tristique est et tempus semper est quam pharetra magna ac consequat metus sapien ut
08/03/2015,8957,vulputate ut ultrices vel augue vestibulum ante ipsum primis in faucibus orci luctus et ultrices posuere
05/25/2019,1260,vitae ipsum aliquam non mauris morbi non lectus aliquam sit amet diam
08/09/2015,2456,vel enim sit amet nunc viverra dapibus nulla suscipit ligula in lacus curabitur at ipsum
03/03/2017,6919,suspendisse potenti cras in purus eu magna vulputate luctus cum sociis natoque penatibus et magnis
12/05/2019,4764,aliquet at feugiat non pretium quis lectus suspendisse potenti in eleifend quam a odio in hac habitasse platea dictumst maecenas
02/25/2021,9737,nam ultrices libero non mattis pulvinar nulla pede ullamcorper augue a
12/31/2019,2464,diam neque vestibulum eget vulputate ut ultrices vel augue vestibulum ante ipsum primis in faucibus orci
06/15/2017,537,augue quam sollicitudin vitae consectetuer eget rutrum at lorem integer tincidunt ante
02/17/2015,9409,maecenas rhoncus aliquam lacus morbi quis tortor id nulla ultrices aliquet maecenas leo
07/19/2019,2779,dolor sit amet consectetuer adipiscing elit proin risus praesent lectus vestibulum quam sapien varius ut blandit non interdum
10/05/2015,603,diam erat fermentum justo nec condimentum neque sapien placerat ante nulla justo aliquam quis turpis eget elit sodales scelerisque mauris
11/03/2021,8684,massa id nisl venenatis lacinia aenean sit amet justo morbi ut odio cras mi pede malesuada in
10/29/2020,6773,imperdiet et commodo vulputate justo in blandit ultrices enim lorem ipsum dolor sit
09/28/2018,6996,aenean auctor gravida sem praesent id massa id nisl venenatis lacinia aenean
06/05/2021,4253,nunc rhoncus dui vel sem sed sagittis nam congue risus semper porta volutpat quam pede lobortis ligula sit amet
02/28/2016,2858,at feugiat non pretium quis lectus suspendisse potenti in eleifend
06/03/2018,3289,proin at turpis a pede posuere nonummy integer non velit
07/30/2020,2803,vel sem sed sagittis nam congue risus semper porta volutpat quam pede lobortis ligula sit amet eleifend pede libero quis
07/12/2017,653,vulputate justo in blandit ultrices enim lorem ipsum dolor sit amet consectetuer adipiscing elit proin interdum mauris non
11/03/2018,1881,blandit nam nulla integer pede justo lacinia eget tincidunt eget tempus vel pede morbi porttitor
11/21/2017,2379,curae nulla dapibus dolor vel est donec odio justo sollicitudin ut suscipit a feugiat
11/15/2019,7083,est et tempus semper est quam pharetra magna ac consequat metus sapien ut nunc vestibulum ante ipsum primis in
08/17/2017,6837,pede lobortis ligula sit amet eleifend pede libero quis orci nullam molestie
10/20/2015,4551,pede lobortis ligula sit amet eleifend pede libero quis orci nullam molestie nibh in lectus pellentesque at
10/13/2021,7521,lacus morbi quis tortor id nulla ultrices aliquet maecenas leo odio condimentum id luctus nec molestie sed justo
07/05/2019,412,metus vitae ipsum aliquam non mauris morbi non lectus aliquam sit amet diam in
10/14/2020,8470,est congue elementum in hac habitasse platea dictumst morbi vestibulum velit id pretium iaculis diam erat fermentum
08/18/2015,5352,accumsan felis ut at dolor quis odio consequat varius integer ac leo
10/14/2019,4856,mauris morbi non lectus aliquam sit amet diam in magna bibendum imperdiet nullam orci
05/19/2021,8412,convallis nunc proin at turpis a pede posuere nonummy integer non velit
09/23/2019,4858,malesuada in imperdiet et commodo vulputate justo in blandit ultrices enim lorem ipsum dolor sit amet consectetuer
06/10/2021,6405,potenti in eleifend quam a odio in hac habitasse platea dictumst maecenas ut massa quis augue luctus tincidunt
05/15/2018,8870,enim blandit mi in porttitor pede justo eu massa donec dapibus duis at
03/09/2018,3675,aliquam lacus morbi quis tortor id nulla ultrices aliquet maecenas
03/22/2015,6483,proin eu mi nulla ac enim in tempor turpis nec euismod scelerisque quam
04/23/2019,9493,sed lacus morbi sem mauris laoreet ut rhoncus aliquet pulvinar sed nisl nunc rhoncus dui vel sem sed
08/22/2020,2114,turpis sed ante vivamus tortor duis mattis egestas metus aenean fermentum donec ut mauris
01/02/2018,6931,mattis egestas metus aenean fermentum donec ut mauris eget massa tempor convallis
06/03/2016,2847,ipsum praesent blandit lacinia erat vestibulum sed magna at nunc commodo placerat praesent
02/24/2019,512,dictumst morbi vestibulum velit id pretium iaculis diam erat fermentum justo nec condimentum neque sapien placerat
01/20/2015,7097,aliquet massa id lobortis convallis tortor risus dapibus augue vel accumsan tellus nisi eu orci mauris lacinia sapien quis libero
04/17/2016,5219,quam fringilla rhoncus mauris enim leo rhoncus sed vestibulum sit
01/09/2020,9318,mauris sit amet eros suspendisse accumsan tortor quis turpis sed ante vivamus tortor duis mattis egestas metus aenean fermentum
09/07/2016,6119,gravida sem praesent id massa id nisl venenatis lacinia aenean sit amet justo morbi ut odio cras mi pede
10/10/2021,8673,suspendisse potenti in eleifend quam a odio in hac habitasse platea dictumst maecenas ut massa quis
07/10/2019,9623,posuere cubilia curae duis faucibus accumsan odio curabitur convallis duis consequat dui
10/13/2019,1901,nibh fusce lacus purus aliquet at feugiat non pretium quis lectus suspendisse potenti in eleifend
05/03/2018,8406,donec vitae nisi nam ultrices libero non mattis pulvinar nulla pede ullamcorper
03/17/2021,2002,in hac habitasse platea dictumst morbi vestibulum velit id pretium iaculis diam erat
04/17/2021,3746,vel accumsan tellus nisi eu orci mauris lacinia sapien quis libero nullam sit amet turpis elementum
10/22/2021,412,sit amet eleifend pede libero quis orci nullam molestie nibh in lectus pellentesque at nulla suspendisse potenti cras in purus
07/01/2021,5534,at velit vivamus vel nulla eget eros elementum pellentesque quisque porta volutpat erat quisque erat eros viverra eget congue
12/11/2015,4155,rutrum rutrum neque aenean auctor gravida sem praesent id massa id nisl venenatis lacinia aenean sit amet justo
09/30/2017,5489,tempus vel pede morbi porttitor lorem id ligula suspendisse ornare consequat
02/13/2019,8190,enim leo rhoncus sed vestibulum sit amet cursus id turpis integer aliquet massa id
01/20/2020,8531,eget eros elementum pellentesque quisque porta volutpat erat quisque erat eros viverra eget
08/16/2019,8560,nunc vestibulum ante ipsum primis in faucibus orci luctus et ultrices posuere cubilia curae
09/16/2015,6113,mi nulla ac enim in tempor turpis nec euismod scelerisque quam turpis adipiscing lorem
07/31/2015,7899,morbi non lectus aliquam sit amet diam in magna bibendum imperdiet nullam orci pede venenatis non
11/17/2019,6638,at turpis donec posuere metus vitae ipsum aliquam non mauris morbi non lectus aliquam sit
04/27/2017,7040,in faucibus orci luctus et ultrices posuere cubilia curae duis faucibus accumsan odio curabitur
10/08/2018,9466,platea dictumst etiam faucibus cursus urna ut tellus nulla ut
01/28/2018,6319,pede venenatis non sodales sed tincidunt eu felis fusce posuere felis sed lacus morbi sem mauris laoreet ut
10/05/2016,2556,cursus id turpis integer aliquet massa id lobortis convallis tortor risus dapibus augue vel accumsan tellus nisi
02/24/2015,9940,nibh in hac habitasse platea dictumst aliquam augue quam sollicitudin vitae
11/12/2018,4283,donec semper sapien a libero nam dui proin leo odio porttitor id
06/30/2020,8067,lorem vitae mattis nibh ligula nec sem duis aliquam convallis nunc proin at turpis a pede posuere nonummy
01/05/2017,8531,montes nascetur ridiculus mus vivamus vestibulum sagittis sapien cum sociis natoque penatibus et magnis dis parturient montes nascetur
11/21/2018,5656,at ipsum ac tellus semper interdum mauris ullamcorper purus sit amet nulla quisque arcu libero rutrum ac
11/12/2019,5907,suscipit nulla elit ac nulla sed vel enim sit amet nunc viverra dapibus
03/04/2016,3564,accumsan felis ut at dolor quis odio consequat varius integer ac leo pellentesque ultrices
05/01/2016,3343,id pretium iaculis diam erat fermentum justo nec condimentum neque sapien placerat ante nulla
01/08/2017,9201,mattis odio donec vitae nisi nam ultrices libero non mattis pulvinar
01/04/2016,9187,volutpat in congue etiam justo etiam pretium iaculis justo in hac habitasse
03/04/2021,7493,amet justo morbi ut odio cras mi pede malesuada in imperdiet et commodo vulputate
01/12/2016,7836,pellentesque viverra pede ac diam cras pellentesque volutpat dui maecenas tristique est et tempus
09/25/2020,8986,dapibus dolor vel est donec odio justo sollicitudin ut suscipit a feugiat
01/06/2019,5456,rhoncus dui vel sem sed sagittis nam congue risus semper porta volutpat quam pede lobortis ligula sit amet
02/14/2015,6247,egestas metus aenean fermentum donec ut mauris eget massa tempor convallis nulla neque libero convallis eget eleifend luctus
03/17/2019,9007,pede libero quis orci nullam molestie nibh in lectus pellentesque at nulla suspendisse potenti cras in purus eu
01/22/2018,9806,lacus at velit vivamus vel nulla eget eros elementum pellentesque quisque
09/14/2021,2695,amet eros suspendisse accumsan tortor quis turpis sed ante vivamus tortor duis mattis egestas
03/28/2015,1352,integer ac neque duis bibendum morbi non quam nec dui luctus rutrum nulla tellus
05/24/2021,1460,pulvinar sed nisl nunc rhoncus dui vel sem sed sagittis nam congue risus semper porta volutpat quam
01/23/2016,9833,eros viverra eget congue eget semper rutrum nulla nunc purus phasellus in felis donec semper
07/26/2016,7759,lorem id ligula suspendisse ornare consequat lectus in est risus auctor sed tristique in tempus sit amet sem fusce
02/11/2015,2500,nibh in hac habitasse platea dictumst aliquam augue quam sollicitudin
11/07/2019,3683,faucibus orci luctus et ultrices posuere cubilia curae donec pharetra
06/22/2015,8582,aliquam non mauris morbi non lectus aliquam sit amet diam in magna bibendum imperdiet nullam orci
06/13/2021,798,quis lectus suspendisse potenti in eleifend quam a odio in hac habitasse platea dictumst maecenas ut massa
01/13/2018,9113,sapien a libero nam dui proin leo odio porttitor id consequat in consequat
12/26/2017,3380,donec quis orci eget orci vehicula condimentum curabitur in libero ut massa
10/15/2018,1852,tincidunt lacus at velit vivamus vel nulla eget eros elementum pellentesque quisque
04/29/2016,3484,erat eros viverra eget congue eget semper rutrum nulla nunc purus phasellus in felis donec semper
02/21/2017,6351,ac consequat metus sapien ut nunc vestibulum ante ipsum primis in faucibus orci luctus
07/01/2016,770,aliquam augue quam sollicitudin vitae consectetuer eget rutrum at lorem integer tincidunt ante vel ipsum praesent blandit lacinia erat vestibulum
01/29/2017,5724,ante ipsum primis in faucibus orci luctus et ultrices posuere cubilia curae
08/11/2016,1029,nonummy maecenas tincidunt lacus at velit vivamus vel nulla eget eros elementum pellentesque quisque
02/03/2015,8207,donec vitae nisi nam ultrices libero non mattis pulvinar nulla pede ullamcorper augue a
02/24/2019,4608,eu magna vulputate luctus cum sociis natoque penatibus et magnis dis parturient montes nascetur ridiculus mus vivamus
11/30/2021,8933,scelerisque mauris sit amet eros suspendisse accumsan tortor quis turpis sed ante vivamus tortor duis mattis egestas
02/11/2018,8732,mi integer ac neque duis bibendum morbi non quam nec dui luctus rutrum nulla tellus in sagittis dui
09/20/2016,1302,vestibulum eget vulputate ut ultrices vel augue vestibulum ante ipsum primis in faucibus orci luctus et ultrices
01/12/2016,2466,morbi porttitor lorem id ligula suspendisse ornare consequat lectus in est risus auctor sed tristique in tempus
08/27/2018,6205,nam ultrices libero non mattis pulvinar nulla pede ullamcorper augue a suscipit nulla elit ac nulla
01/21/2015,9644,ipsum dolor sit amet consectetuer adipiscing elit proin risus praesent lectus vestibulum quam sapien varius ut blandit non
02/21/2020,9120,justo sollicitudin ut suscipit a feugiat et eros vestibulum ac
12/29/2019,1537,vulputate vitae nisl aenean lectus pellentesque eget nunc donec quis orci eget
09/21/2021,5803,accumsan odio curabitur convallis duis consequat dui nec nisi volutpat eleifend donec ut dolor morbi vel lectus in quam
12/09/2015,7135,mi nulla ac enim in tempor turpis nec euismod scelerisque
06/12/2017,9844,enim in tempor turpis nec euismod scelerisque quam turpis adipiscing lorem vitae mattis nibh ligula nec sem duis
12/26/2017,6259,commodo placerat praesent blandit nam nulla integer pede justo lacinia eget
09/03/2020,6487,neque aenean auctor gravida sem praesent id massa id nisl venenatis lacinia aenean
06/10/2018,7587,erat fermentum justo nec condimentum neque sapien placerat ante nulla justo aliquam quis turpis eget elit sodales
09/15/2019,9349,vitae consectetuer eget rutrum at lorem integer tincidunt ante vel ipsum praesent blandit lacinia erat vestibulum sed magna
11/18/2018,1758,mauris vulputate elementum nullam varius nulla facilisi cras non velit nec nisi vulputate nonummy maecenas tincidunt lacus
09/14/2021,6932,lacus morbi sem mauris laoreet ut rhoncus aliquet pulvinar sed
07/22/2016,4779,nunc purus phasellus in felis donec semper sapien a libero nam dui proin leo odio
05/26/2018,5253,felis ut at dolor quis odio consequat varius integer ac leo
10/31/2018,5680,eu sapien cursus vestibulum proin eu mi nulla ac enim in tempor turpis
03/17/2018,9321,vivamus vel nulla eget eros elementum pellentesque quisque porta volutpat erat quisque erat eros viverra eget congue eget
01/25/2018,7851,eget nunc donec quis orci eget orci vehicula condimentum curabitur in
12/08/2020,1882,ut volutpat sapien arcu sed augue aliquam erat volutpat in congue etiam justo etiam
04/29/2015,1353,tincidunt eget tempus vel pede morbi porttitor lorem id ligula suspendisse ornare consequat lectus in est risus auctor
07/23/2019,9015,neque vestibulum eget vulputate ut ultrices vel augue vestibulum ante
06/12/2017,6168,justo sit amet sapien dignissim vestibulum vestibulum ante ipsum primis in
12/24/2020,7205,lobortis ligula sit amet eleifend pede libero quis orci nullam molestie nibh in lectus pellentesque at
12/25/2015,2446,justo maecenas rhoncus aliquam lacus morbi quis tortor id nulla
08/04/2016,2730,felis sed interdum venenatis turpis enim blandit mi in porttitor pede justo
03/21/2021,9379,convallis tortor risus dapibus augue vel accumsan tellus nisi eu
10/06/2017,2981,sed tristique in tempus sit amet sem fusce consequat nulla nisl nunc nisl duis bibendum felis
06/24/2015,6886,vestibulum proin eu mi nulla ac enim in tempor turpis nec euismod scelerisque
11/20/2021,4294,vestibulum aliquet ultrices erat tortor sollicitudin mi sit amet lobortis sapien sapien non mi integer ac neque
02/21/2019,8710,praesent lectus vestibulum quam sapien varius ut blandit non interdum
05/17/2020,5782,nisi vulputate nonummy maecenas tincidunt lacus at velit vivamus vel
09/26/2016,5796,cursus urna ut tellus nulla ut erat id mauris vulputate elementum nullam varius nulla facilisi cras non velit nec nisi
10/20/2019,1069,lacus morbi sem mauris laoreet ut rhoncus aliquet pulvinar sed nisl nunc rhoncus dui vel
07/18/2020,1954,lectus in est risus auctor sed tristique in tempus sit amet sem fusce consequat
06/06/2021,9289,sit amet cursus id turpis integer aliquet massa id lobortis
