01/04/2021,4677,ut nulla sed accumsan felis ut at dolor quis odio consequat varius integer
05/14/2018,4765,curabitur at ipsum ac tellus semper interdum mauris ullamcorper purus sit amet nulla quisque arcu
07/26/2016,1168,sed ante vivamus tortor duis mattis egestas metus aenean fermentum donec ut mauris eget massa tempor convallis
03/20/2017,999,pretium nisl ut volutpat sapien arcu sed augue aliquam erat volutpat
02/16/2020,9882,nunc proin at turpis a pede posuere nonummy integer non velit donec diam
04/30/2018,5518,massa id lobortis convallis tortor risus dapibus augue vel accumsan tellus nisi
07/15/2017,7341,sed augue aliquam erat volutpat in congue etiam justo etiam pretium iaculis justo in hac habitasse platea
03/06/2021,7206,sagittis dui vel nisl duis ac nibh fusce lacus purus aliquet at feugiat non pretium
10/16/2019,6461,curabitur in libero ut massa volutpat convallis morbi odio odio
10/16/2021,3700,morbi non lectus aliquam sit amet diam in magna bibendum imperdiet nullam orci pede venenatis
03/17/2019,9559,ut tellus nulla ut erat id mauris vulputate elementum nullam varius nulla facilisi cras non velit nec nisi vulputate
01/13/2021,6763,sapien ut nunc vestibulum ante ipsum primis in faucibus orci
07/23/2017,9619,integer aliquet massa id lobortis convallis tortor risus dapibus augue vel accumsan tellus nisi eu orci
05/13/2017,4309,morbi odio odio elementum eu interdum eu tincidunt in leo maecenas pulvinar lobortis
05/07/2018,1208,dui proin leo odio porttitor id consequat in consequat ut
01/15/2016,4203,placerat praesent blandit nam nulla integer pede justo lacinia eget tincidunt eget tempus vel pede morbi
11/28/2017,5564,viverra eget congue eget semper rutrum nulla nunc purus phasellus in felis donec
05/12/2018,2078,tincidunt ante vel ipsum praesent blandit lacinia erat vestibulum sed magna at nunc
11/17/2021,7779,ultrices posuere cubilia curae nulla dapibus dolor vel est donec odio justo sollicitudin ut suscipit a
05/03/2020,4096,quam a odio in hac habitasse platea dictumst maecenas ut massa quis augue luctus tincidunt nulla mollis molestie lorem
02/10/2018,7503,sagittis sapien cum sociis natoque penatibus et magnis dis parturient montes nascetur ridiculus mus etiam vel augue vestibulum rutrum rutrum
10/08/2016,9640,tempus vivamus in felis eu sapien cursus vestibulum proin eu mi nulla ac
08/29/2018,4779,morbi vestibulum velit id pretium iaculis diam erat fermentum justo nec condimentum neque sapien
11/07/2015,9210,placerat praesent blandit nam nulla integer pede justo lacinia eget tincidunt eget tempus vel
07/14/2020,1923,integer ac neque duis bibendum morbi non quam nec dui luctus rutrum nulla tellus in sagittis dui
12/05/2017,3115,ligula suspendisse ornare consequat lectus in est risus auctor sed tristique in tempus
07/25/2018,5184,magna vulputate luctus cum sociis natoque penatibus et magnis dis parturient montes nascetur ridiculus mus vivamus vestibulum sagittis
06/12/2015,2087,ultrices posuere cubilia curae mauris viverra diam vitae quam suspendisse potenti nullam porttitor lacus at
05/26/2016,3133,in consequat ut nulla sed accumsan felis ut at dolor quis odio
07/16/2021,1807,quis turpis eget elit sodales scelerisque mauris sit amet eros suspendisse accumsan tortor quis
03/03/2018,4429,nulla elit ac nulla sed vel enim sit amet nunc viverra dapibus nulla suscipit ligula in lacus curabitur at ipsum
07/18/2015,2877,vel est donec odio justo sollicitudin ut suscipit a feugiat et eros vestibulum ac est lacinia nisi venenatis tristique
08/11/2021,4547,amet eleifend pede libero quis orci nullam molestie nibh in lectus pellentesque at nulla suspendisse potenti
08/23/2016,1248,at feugiat non pretium quis lectus suspendisse potenti in eleifend quam a
07/02/2016,6457,nullam sit amet turpis elementum ligula vehicula consequat morbi a ipsum integer
06/30/2019,7368,cras in purus eu magna vulputate luctus cum sociis natoque penatibus et magnis
11/21/2019,5630,massa tempor convallis nulla neque libero convallis eget eleifend luctus ultricies eu nibh quisque id
04/13/2019,7267,ac diam cras pellentesque volutpat dui maecenas tristique est et tempus semper est quam pharetra magna ac consequat metus sapien
03/11/2016,641,eu sapien cursus vestibulum proin eu mi nulla ac enim in tempor turpis nec euismod
12/12/2019,5501,massa volutpat convallis morbi odio odio elementum eu interdum eu tincidunt in leo maecenas pulvinar lobortis est phasellus sit amet
06/22/2015,7355,lacus curabitur at ipsum ac tellus semper interdum mauris ullamcorper purus sit amet nulla quisque arcu libero
09/11/2016,2858,nulla ultrices aliquet maecenas leo odio condimentum id luctus nec
09/06/2016,2758,integer ac neque duis bibendum morbi non quam nec dui luctus rutrum nulla tellus in
03/12/2017,1188,quis orci eget orci vehicula condimentum curabitur in libero ut massa volutpat convallis morbi odio odio elementum eu interdum
08/31/2015,3664,platea dictumst maecenas ut massa quis augue luctus tincidunt nulla mollis molestie lorem quisque ut erat curabitur
09/05/2018,8919,felis fusce posuere felis sed lacus morbi sem mauris laoreet ut rhoncus
04/17/2016,3338,imperdiet nullam orci pede venenatis non sodales sed tincidunt eu felis fusce
09/02/2020,3783,pede libero quis orci nullam molestie nibh in lectus pellentesque at nulla
07/29/2016,9631,ultrices libero non mattis pulvinar nulla pede ullamcorper augue a suscipit nulla elit ac nulla sed vel enim
09/29/2017,5511,morbi quis tortor id nulla ultrices aliquet maecenas leo odio condimentum
01/29/2021,6152,sem fusce consequat nulla nisl nunc nisl duis bibendum felis sed interdum venenatis turpis enim
03/31/2020,3501,interdum mauris ullamcorper purus sit amet nulla quisque arcu libero rutrum
07/31/2020,4392,luctus nec molestie sed justo pellentesque viverra pede ac diam cras pellentesque
10/14/2018,4442,fusce consequat nulla nisl nunc nisl duis bibendum felis sed interdum venenatis turpis enim blandit mi in porttitor
01/26/2016,6269,aenean auctor gravida sem praesent id massa id nisl venenatis lacinia aenean sit amet justo morbi
03/11/2015,3756,faucibus orci luctus et ultrices posuere cubilia curae donec pharetra magna vestibulum aliquet ultrices erat tortor
12/07/2018,7237,in purus eu magna vulputate luctus cum sociis natoque penatibus et magnis dis parturient montes nascetur ridiculus mus vivamus
06/01/2019,5730,erat vestibulum sed magna at nunc commodo placerat praesent blandit nam nulla integer pede justo lacinia eget
07/28/2018,5866,lectus pellentesque at nulla suspendisse potenti cras in purus eu magna vulputate luctus cum sociis natoque penatibus et magnis dis
11/21/2021,7374,nulla integer pede justo lacinia eget tincidunt eget tempus vel pede morbi porttitor lorem id ligula suspendisse ornare consequat
06/14/2015,211,posuere cubilia curae mauris viverra diam vitae quam suspendisse potenti nullam porttitor lacus at turpis
06/02/2017,8518,justo maecenas rhoncus aliquam lacus morbi quis tortor id nulla ultrices aliquet maecenas leo
01/23/2021,6477,odio in hac habitasse platea dictumst maecenas ut massa quis augue luctus tincidunt nulla mollis
01/21/2021,2413,interdum mauris ullamcorper purus sit amet nulla quisque arcu libero rutrum ac lobortis vel dapibus at diam nam
07/20/2021,4874,aenean auctor gravida sem praesent id massa id nisl venenatis lacinia aenean sit amet justo morbi ut
02/17/2020,7953,integer non velit donec diam neque vestibulum eget vulputate ut ultrices
12/11/2017,6761,pretium iaculis justo in hac habitasse platea dictumst etiam faucibus cursus urna ut tellus nulla ut erat
08/12/2020,9032,rutrum nulla nunc purus phasellus in felis donec semper sapien
10/21/2020,5610,sed magna at nunc commodo placerat praesent blandit nam nulla
05/23/2016,3461,vestibulum aliquet ultrices erat tortor sollicitudin mi sit amet lobortis sapien sapien non mi
11/22/2018,2782,sed tincidunt eu felis fusce posuere felis sed lacus morbi sem
10/31/2019,3511,praesent id massa id nisl venenatis lacinia aenean sit amet justo morbi ut odio cras mi pede malesuada in imperdiet
06/29/2016,6918,sed justo pellentesque viverra pede ac diam cras pellentesque volutpat dui
02/04/2018,5822,semper sapien a libero nam dui proin leo odio porttitor id consequat
06/15/2021,6404,integer non velit donec diam neque vestibulum eget vulputate ut ultrices vel augue vestibulum ante ipsum
05/19/2015,6814,at nibh in hac habitasse platea dictumst aliquam augue quam sollicitudin vitae consectetuer eget rutrum at lorem integer tincidunt ante
07/08/2018,9477,ridiculus mus vivamus vestibulum sagittis sapien cum sociis natoque penatibus et magnis dis parturient montes nascetur ridiculus mus etiam
09/09/2015,8613,ligula sit amet eleifend pede libero quis orci nullam molestie nibh in
08/27/2020,7627,blandit lacinia erat vestibulum sed magna at nunc commodo placerat praesent blandit nam nulla integer pede justo lacinia
12/05/2021,3733,neque libero convallis eget eleifend luctus ultricies eu nibh quisque id justo sit amet sapien dignissim vestibulum
02/01/2016,2622,nisl nunc nisl duis bibendum felis sed interdum venenatis turpis enim
06/06/2019,5980,quis turpis sed ante vivamus tortor duis mattis egestas metus aenean fermentum donec ut mauris eget massa tempor convallis
10/18/2020,8399,sem sed sagittis nam congue risus semper porta volutpat quam pede lobortis ligula sit amet eleifend pede libero quis
04/07/2020,7802,luctus et ultrices posuere cubilia curae nulla dapibus dolor vel est donec odio justo sollicitudin
07/10/2021,572,pede malesuada in imperdiet et commodo vulputate justo in blandit
08/20/2021,2934,feugiat et eros vestibulum ac est lacinia nisi venenatis tristique fusce congue diam id ornare imperdiet sapien urna pretium nisl
01/18/2017,8913,donec pharetra magna vestibulum aliquet ultrices erat tortor sollicitudin mi sit amet lobortis sapien sapien non mi integer
05/02/2015,4132,erat volutpat in congue etiam justo etiam pretium iaculis justo in hac habitasse platea dictumst etiam faucibus
06/04/2017,2597,feugiat et eros vestibulum ac est lacinia nisi venenatis tristique fusce congue diam id ornare imperdiet sapien urna pretium nisl
11/11/2018,1190,montes nascetur ridiculus mus vivamus vestibulum sagittis sapien cum sociis natoque penatibus et magnis dis parturient montes nascetur ridiculus
05/17/2021,3769,semper est quam pharetra magna ac consequat metus sapien ut nunc
03/30/2020,7464,eu massa donec dapibus duis at velit eu est congue elementum in hac habitasse platea dictumst morbi vestibulum
04/14/2018,3702,nisi eu orci mauris lacinia sapien quis libero nullam sit amet
06/09/2019,4844,orci eget orci vehicula condimentum curabitur in libero ut massa volutpat convallis morbi odio odio elementum eu interdum eu tincidunt
09/26/2020,811,lobortis convallis tortor risus dapibus augue vel accumsan tellus nisi eu orci mauris lacinia sapien quis
05/07/2019,2219,scelerisque quam turpis adipiscing lorem vitae mattis nibh ligula nec sem duis aliquam convallis nunc proin at turpis a
01/05/2019,1675,elit proin risus praesent lectus vestibulum quam sapien varius ut blandit non interdum in ante vestibulum ante ipsum primis
01/05/2015,2388,vestibulum eget vulputate ut ultrices vel augue vestibulum ante ipsum primis in faucibus orci luctus et ultrices posuere cubilia
10/29/2016,6001,cursus id turpis integer aliquet massa id lobortis convallis tortor risus dapibus augue vel accumsan tellus nisi
08/02/2019,4728,mi integer ac neque duis bibendum morbi non quam nec dui luctus rutrum nulla
12/11/2019,4802,faucibus orci luctus et ultrices posuere cubilia curae donec pharetra magna vestibulum aliquet ultrices erat tortor sollicitudin mi sit
10/27/2015,9657,vitae ipsum aliquam non mauris morbi non lectus aliquam sit amet diam in magna
12/29/2020,1490,ligula sit amet eleifend pede libero quis orci nullam molestie nibh in lectus pellentesque at nulla suspendisse potenti
06/04/2018,2809,porttitor lacus at turpis donec posuere metus vitae ipsum aliquam non
12/29/2018,5978,nisi venenatis tristique fusce congue diam id ornare imperdiet sapien urna pretium nisl ut volutpat
09/01/2018,281,est quam pharetra magna ac consequat metus sapien ut nunc vestibulum ante ipsum primis in
03/11/2020,3062,vitae nisl aenean lectus pellentesque eget nunc donec quis orci eget orci vehicula condimentum curabitur in libero ut
02/27/2018,5416,penatibus et magnis dis parturient montes nascetur ridiculus mus etiam
08/28/2017,7375,sapien arcu sed augue aliquam erat volutpat in congue etiam
08/25/2017,6859,cras non velit nec nisi vulputate nonummy maecenas tincidunt lacus at velit vivamus vel nulla eget eros
05/01/2021,7721,nec nisi volutpat eleifend donec ut dolor morbi vel lectus in quam fringilla rhoncus mauris
09/20/2020,8493,sit amet sapien dignissim vestibulum vestibulum ante ipsum primis in faucibus orci luctus et ultrices posuere cubilia curae nulla dapibus
09/22/2017,6547,tortor risus dapibus augue vel accumsan tellus nisi eu orci mauris lacinia sapien
05/20/2020,7950,non quam nec dui luctus rutrum nulla tellus in sagittis dui vel nisl duis ac nibh fusce lacus
06/16/2019,671,in est risus auctor sed tristique in tempus sit amet
09/04/2015,7768,congue eget semper rutrum nulla nunc purus phasellus in felis donec semper sapien a libero nam dui proin leo
01/31/2015,5660,lobortis ligula sit amet eleifend pede libero quis orci nullam molestie
01/30/2021,1932,pretium nisl ut volutpat sapien arcu sed augue aliquam erat volutpat in
08/01/2019,7699,est risus auctor sed tristique in tempus sit amet sem
12/07/2020,7545,hac habitasse platea dictumst morbi vestibulum velit id pretium iaculis diam erat fermentum justo nec condimentum neque sapien
07/24/2017,1252,mauris viverra diam vitae quam suspendisse potenti nullam porttitor lacus at turpis donec posuere metus vitae ipsum aliquam non mauris
02/08/2021,1926,sed sagittis nam congue risus semper porta volutpat quam pede lobortis ligula sit amet eleifend pede libero quis orci
03/26/2017,3483,felis fusce posuere felis sed lacus morbi sem mauris laoreet ut rhoncus
07/04/2018,7604,lobortis sapien sapien non mi integer ac neque duis bibendum morbi non quam nec dui luctus rutrum nulla tellus in
10/04/2018,1069,vivamus vel nulla eget eros elementum pellentesque quisque porta volutpat erat quisque erat eros viverra eget
06/21/2020,3142,at lorem integer tincidunt ante vel ipsum praesent blandit lacinia erat vestibulum sed
06/28/2021,2696,sed vestibulum sit amet cursus id turpis integer aliquet massa id lobortis convallis tortor risus
05/25/2016,9374,amet eleifend pede libero quis orci nullam molestie nibh in lectus pellentesque at nulla suspendisse potenti cras in purus eu
06/27/2017,4085,felis eu sapien cursus vestibulum proin eu mi nulla ac enim in tempor turpis nec euismod scelerisque quam
10/23/2019,2207,tellus nulla ut erat id mauris vulputate elementum nullam varius nulla facilisi cras non velit nec nisi
03/19/2017,5512,rutrum rutrum neque aenean auctor gravida sem praesent id massa id nisl venenatis lacinia aenean sit amet
05/11/2017,2161,vestibulum velit id pretium iaculis diam erat fermentum justo nec condimentum neque
08/08/2015,6638,orci mauris lacinia sapien quis libero nullam sit amet turpis elementum ligula
09/11/2016,5544,ut nunc vestibulum ante ipsum primis in faucibus orci luctus et ultrices posuere cubilia
10/18/2021,1340,tristique est et tempus semper est quam pharetra magna ac consequat
10/17/2020,6634,erat nulla tempus vivamus in felis eu sapien cursus vestibulum proin eu mi nulla ac enim in
03/14/2017,9807,turpis nec euismod scelerisque quam turpis adipiscing lorem vitae mattis nibh ligula nec sem duis
01/13/2016,2062,commodo vulputate justo in blandit ultrices enim lorem ipsum dolor sit amet consectetuer adipiscing elit proin interdum mauris non
07/19/2017,482,ultrices posuere cubilia curae duis faucibus accumsan odio curabitur convallis duis consequat dui nec nisi volutpat eleifend donec
11/22/2019,3037,accumsan odio curabitur convallis duis consequat dui nec nisi volutpat eleifend donec ut dolor
11/15/2021,9331,nullam sit amet turpis elementum ligula vehicula consequat morbi a ipsum integer a nibh in quis justo maecenas
02/09/2015,3380,cursus id turpis integer aliquet massa id lobortis convallis tortor risus dapibus augue vel accumsan tellus nisi eu
05/17/2015,7453,sed justo pellentesque viverra pede ac diam cras pellentesque volutpat dui maecenas tristique
03/12/2016,3270,curae mauris viverra diam vitae quam suspendisse potenti nullam porttitor lacus at turpis donec posuere metus vitae ipsum aliquam
05/19/2016,8290,aliquam erat volutpat in congue etiam justo etiam pretium iaculis justo in hac habitasse platea dictumst etiam
03/23/2019,3723,posuere metus vitae ipsum aliquam non mauris morbi non lectus aliquam sit amet
05/16/2020,7075,quisque porta volutpat erat quisque erat eros viverra eget congue eget semper rutrum nulla
05/16/2018,5637,ligula sit amet eleifend pede libero quis orci nullam molestie nibh in
06/28/2016,5436,leo pellentesque ultrices mattis odio donec vitae nisi nam ultrices libero non mattis pulvinar nulla pede ullamcorper augue a suscipit
08/03/2021,5154,turpis nec euismod scelerisque quam turpis adipiscing lorem vitae mattis nibh
08/31/2017,3475,lorem ipsum dolor sit amet consectetuer adipiscing elit proin risus
11/08/2016,3953,elit proin interdum mauris non ligula pellentesque ultrices phasellus id
02/23/2018,2375,duis mattis egestas metus aenean fermentum donec ut mauris eget massa tempor convallis
02/14/2021,1364,urna pretium nisl ut volutpat sapien arcu sed augue aliquam erat volutpat in congue etiam justo
08/29/2017,6966,donec ut dolor morbi vel lectus in quam fringilla rhoncus mauris enim leo rhoncus sed vestibulum sit amet cursus
07/20/2017,5653,pede justo eu massa donec dapibus duis at velit eu est congue elementum in hac habitasse platea dictumst morbi vestibulum
12/25/2021,8718,vestibulum proin eu mi nulla ac enim in tempor turpis nec euismod scelerisque quam turpis adipiscing lorem vitae
01/12/2017,8182,at vulputate vitae nisl aenean lectus pellentesque eget nunc donec quis orci eget orci vehicula condimentum curabitur in
01/03/2020,3844,erat eros viverra eget congue eget semper rutrum nulla nunc
11/13/2016,2011,turpis elementum ligula vehicula consequat morbi a ipsum integer a nibh in quis justo maecenas rhoncus
10/19/2019,818,adipiscing lorem vitae mattis nibh ligula nec sem duis aliquam convallis nunc proin at turpis
12/02/2019,4599,turpis eget elit sodales scelerisque mauris sit amet eros suspendisse accumsan tortor
02/12/2016,7110,pede malesuada in imperdiet et commodo vulputate justo in blandit ultrices enim lorem ipsum dolor sit amet
01/16/2016,1323,donec odio justo sollicitudin ut suscipit a feugiat et eros vestibulum ac est
12/08/2019,7065,habitasse platea dictumst morbi vestibulum velit id pretium iaculis diam erat fermentum
11/19/2021,6268,quis turpis eget elit sodales scelerisque mauris sit amet eros suspendisse accumsan tortor
12/10/2021,2189,purus phasellus in felis donec semper sapien a libero nam
08/22/2021,9383,luctus et ultrices posuere cubilia curae duis faucibus accumsan odio curabitur convallis duis
07/26/2021,3604,turpis a pede posuere nonummy integer non velit donec diam neque vestibulum
08/21/2019,5018,amet eleifend pede libero quis orci nullam molestie nibh in lectus pellentesque at nulla suspendisse potenti cras
08/25/2016,249,massa id lobortis convallis tortor risus dapibus augue vel accumsan tellus nisi
06/19/2015,2823,eget massa tempor convallis nulla neque libero convallis eget eleifend luctus ultricies eu nibh quisque id
03/22/2021,7975,sem praesent id massa id nisl venenatis lacinia aenean sit amet justo
11/20/2019,3329,at lorem integer tincidunt ante vel ipsum praesent blandit lacinia erat vestibulum sed magna
08/19/2020,5770,maecenas leo odio condimentum id luctus nec molestie sed justo pellentesque viverra pede
10/13/2015,7115,varius ut blandit non interdum in ante vestibulum ante ipsum primis in faucibus orci
07/25/2018,8006,quam sapien varius ut blandit non interdum in ante vestibulum ante ipsum
01/16/2016,8117,id luctus nec molestie sed justo pellentesque viverra pede ac diam
02/17/2019,2188,rutrum nulla nunc purus phasellus in felis donec semper sapien a libero nam dui proin leo odio porttitor id
07/05/2017,9333,sed sagittis nam congue risus semper porta volutpat quam pede lobortis ligula sit amet eleifend
05/18/2018,4625,purus aliquet at feugiat non pretium quis lectus suspendisse potenti in eleifend quam a odio in hac habitasse platea
04/11/2020,4842,et ultrices posuere cubilia curae duis faucibus accumsan odio curabitur convallis duis consequat dui
01/19/2021,2072,fusce lacus purus aliquet at feugiat non pretium quis lectus
11/22/2016,5440,nulla suspendisse potenti cras in purus eu magna vulputate luctus cum sociis natoque penatibus et magnis dis
11/06/2020,6706,bibendum imperdiet nullam orci pede venenatis non sodales sed tincidunt eu felis fusce posuere felis sed lacus
01/12/2016,7288,nullam orci pede venenatis non sodales sed tincidunt eu felis fusce posuere felis sed lacus morbi sem mauris
09/27/2018,8992,donec semper sapien a libero nam dui proin leo odio porttitor id consequat in consequat ut nulla sed accumsan felis
06/04/2020,1097,in congue etiam justo etiam pretium iaculis justo in hac habitasse platea dictumst etiam faucibus cursus
05/23/2015,3644,at nunc commodo placerat praesent blandit nam nulla integer pede justo lacinia eget tincidunt eget tempus vel
01/21/2019,4729,nisl duis ac nibh fusce lacus purus aliquet at feugiat non pretium quis lectus suspendisse potenti in
09/19/2020,930,tincidunt eget tempus vel pede morbi porttitor lorem id ligula suspendisse ornare consequat
08/20/2017,5170,eget tempus vel pede morbi porttitor lorem id ligula suspendisse ornare consequat lectus in est risus auctor sed
08/19/2016,1798,condimentum neque sapien placerat ante nulla justo aliquam quis turpis eget elit
07/28/2015,7101,hac habitasse platea dictumst etiam faucibus cursus urna ut tellus nulla ut erat id mauris vulputate elementum nullam
12/31/2019,7183,sapien varius ut blandit non interdum in ante vestibulum ante ipsum primis in faucibus orci luctus et ultrices posuere
01/10/2015,1500,sed lacus morbi sem mauris laoreet ut rhoncus aliquet pulvinar sed nisl nunc rhoncus dui vel
12/21/2019,479,a odio in hac habitasse platea dictumst maecenas ut massa quis augue luctus tincidunt nulla
03/08/2021,1239,quam pharetra magna ac consequat metus sapien ut nunc vestibulum
02/23/2017,3235,placerat ante nulla justo aliquam quis turpis eget elit sodales scelerisque mauris sit
12/18/2015,7979,at turpis a pede posuere nonummy integer non velit donec
09/09/2021,7895,vestibulum rutrum rutrum neque aenean auctor gravida sem praesent id
12/06/2020,1161,volutpat in congue etiam justo etiam pretium iaculis justo in hac habitasse platea dictumst etiam faucibus
06/04/2017,3497,ipsum aliquam non mauris morbi non lectus aliquam sit amet diam in magna bibendum imperdiet nullam
01/12/2017,2100,diam in magna bibendum imperdiet nullam orci pede venenatis non
04/22/2018,6553,euismod scelerisque quam turpis adipiscing lorem vitae mattis nibh ligula nec sem duis aliquam convallis nunc proin
02/09/2020,8464,in purus eu magna vulputate luctus cum sociis natoque penatibus et
04/01/2018,2527,a libero nam dui proin leo odio porttitor id consequat in consequat ut nulla sed accumsan
04/28/2016,5724,sapien iaculis congue vivamus metus arcu adipiscing molestie hendrerit at
06/01/2019,7612,quam fringilla rhoncus mauris enim leo rhoncus sed vestibulum sit amet cursus id turpis integer
03/13/2021,2390,imperdiet sapien urna pretium nisl ut volutpat sapien arcu sed augue aliquam erat volutpat in congue etiam justo etiam pretium
11/27/2016,4775,turpis donec posuere metus vitae ipsum aliquam non mauris morbi
09/07/2018,3320,sit amet cursus id turpis integer aliquet massa id lobortis convallis tortor risus dapibus
04/07/2016,122,vestibulum aliquet ultrices erat tortor sollicitudin mi sit amet lobortis sapien sapien non
03/03/2015,1278,nulla ac enim in tempor turpis nec euismod scelerisque quam turpis adipiscing lorem vitae
07/14/2019,9992,fusce lacus purus aliquet at feugiat non pretium quis lectus suspendisse
04/28/2021,6127,porta volutpat quam pede lobortis ligula sit amet eleifend pede libero quis
07/03/2016,5567,dis parturient montes nascetur ridiculus mus etiam vel augue vestibulum rutrum rutrum neque aenean auctor gravida sem praesent
10/08/2017,1421,magna vulputate luctus cum sociis natoque penatibus et magnis dis parturient montes nascetur ridiculus mus vivamus vestibulum sagittis sapien
09/02/2021,5144,sapien placerat ante nulla justo aliquam quis turpis eget elit sodales scelerisque mauris sit amet eros suspendisse accumsan tortor quis
09/17/2018,1214,non pretium quis lectus suspendisse potenti in eleifend quam a
10/07/2016,391,vel sem sed sagittis nam congue risus semper porta volutpat quam pede lobortis ligula sit amet eleifend
06/15/2019,9726,tempus semper est quam pharetra magna ac consequat metus sapien
12/04/2015,8139,dapibus duis at velit eu est congue elementum in hac habitasse platea dictumst morbi
07/06/2018,1987,congue eget semper rutrum nulla nunc purus phasellus in felis donec semper sapien a libero nam dui proin leo
08/16/2021,1632,nunc viverra dapibus nulla suscipit ligula in lacus curabitur at ipsum ac tellus semper interdum
04/10/2015,2622,eleifend luctus ultricies eu nibh quisque id justo sit amet sapien dignissim vestibulum vestibulum ante ipsum primis in faucibus orci
05/09/2021,1865,posuere cubilia curae duis faucibus accumsan odio curabitur convallis duis consequat dui
11/14/2018,949,eu nibh quisque id justo sit amet sapien dignissim vestibulum vestibulum ante
10/21/2019,8030,tortor sollicitudin mi sit amet lobortis sapien sapien non mi integer ac neque duis bibendum
05/15/2019,4984,id nulla ultrices aliquet maecenas leo odio condimentum id luctus nec
