09/05/2020,7945,nisi vulputate nonummy maecenas tincidunt lacus at velit vivamus vel nulla eget eros elementum pellentesque
12/02/2015,5548,dictumst maecenas ut massa quis augue luctus tincidunt nulla mollis
08/16/2020,7991,duis bibendum felis sed interdum venenatis turpis enim blandit mi in porttitor pede justo
01/24/2019,9714,hac habitasse platea dictumst maecenas ut massa quis augue luctus tincidunt nulla mollis molestie lorem quisque ut erat curabitur gravida
01/06/2020,809,felis donec semper sapien a libero nam dui proin leo odio porttitor id consequat in consequat ut nulla sed
11/25/2020,7335,potenti nullam porttitor lacus at turpis donec posuere metus vitae ipsum
01/19/2016,2644,sapien cum sociis natoque penatibus et magnis dis parturient montes
06/18/2021,1043,morbi porttitor lorem id ligula suspendisse ornare consequat lectus in est risus auctor
08/16/2016,4205,nisl ut volutpat sapien arcu sed augue aliquam erat volutpat in congue etiam
09/13/2017,8283,cubilia curae nulla dapibus dolor vel est donec odio justo sollicitudin ut suscipit a feugiat et
10/20/2015,4479,amet sapien dignissim vestibulum vestibulum ante ipsum primis in faucibus orci
01/10/2020,1808,elementum eu interdum eu tincidunt in leo maecenas pulvinar lobortis est phasellus sit amet erat nulla tempus vivamus
04/27/2016,1332,proin risus praesent lectus vestibulum quam sapien varius ut blandit non interdum in ante vestibulum ante ipsum primis in faucibus
09/16/2017,7034,amet turpis elementum ligula vehicula consequat morbi a ipsum integer a nibh in quis justo maecenas
12/08/2017,6387,erat vestibulum sed magna at nunc commodo placerat praesent blandit nam nulla integer pede justo lacinia
09/14/2019,7138,erat tortor sollicitudin mi sit amet lobortis sapien sapien non mi integer ac neque duis bibendum morbi non
10/08/2021,291,lectus in est risus auctor sed tristique in tempus sit amet sem fusce consequat nulla nisl nunc
11/17/2021,6309,velit vivamus vel nulla eget eros elementum pellentesque quisque porta volutpat erat quisque erat eros viverra eget
07/13/2016,1115,suspendisse accumsan tortor quis turpis sed ante vivamus tortor duis mattis egestas
02/27/2017,2463,quisque arcu libero rutrum ac lobortis vel dapibus at diam nam tristique tortor
05/15/2020,6897,justo in hac habitasse platea dictumst etiam faucibus cursus urna ut tellus nulla
03/19/2017,3446,molestie lorem quisque ut erat curabitur gravida nisi at nibh in hac habitasse platea dictumst aliquam augue
03/20/2017,4115,odio donec vitae nisi nam ultrices libero non mattis pulvinar nulla pede ullamcorper augue
01/29/2019,2825,suspendisse potenti in eleifend quam a odio in hac habitasse platea dictumst maecenas ut massa quis augue luctus tincidunt
11/03/2019,556,interdum in ante vestibulum ante ipsum primis in faucibus orci
06/12/2020,353,dignissim vestibulum vestibulum ante ipsum primis in faucibus orci luctus et ultrices posuere cubilia curae nulla dapibus dolor vel
09/17/2020,2143,in faucibus orci luctus et ultrices posuere cubilia curae mauris viverra diam vitae quam suspendisse potenti nullam porttitor
02/06/2019,1719,auctor sed tristique in tempus sit amet sem fusce consequat nulla nisl nunc
09/04/2015,6861,ac neque duis bibendum morbi non quam nec dui luctus rutrum nulla tellus
08/14/2020,6789,mi nulla ac enim in tempor turpis nec euismod scelerisque quam
12/06/2018,7582,nisi venenatis tristique fusce congue diam id ornare imperdiet sapien urna pretium nisl
03/14/2018,3143,lorem ipsum dolor sit amet consectetuer adipiscing elit proin risus
09/08/2020,9912,amet sapien dignissim vestibulum vestibulum ante ipsum primis in faucibus
07/15/2019,6578,nunc proin at turpis a pede posuere nonummy integer non velit donec diam neque vestibulum eget vulputate ut ultrices
09/08/2021,4062,ut suscipit a feugiat et eros vestibulum ac est lacinia nisi venenatis tristique fusce congue diam id ornare imperdiet
01/26/2015,181,ultrices vel augue vestibulum ante ipsum primis in faucibus orci luctus et ultrices posuere cubilia curae
05/16/2019,7264,nec molestie sed justo pellentesque viverra pede ac diam cras pellentesque volutpat dui maecenas tristique est et tempus semper
06/15/2015,6849,nascetur ridiculus mus vivamus vestibulum sagittis sapien cum sociis natoque
03/23/2018,4921,quis lectus suspendisse potenti in eleifend quam a odio in hac habitasse platea dictumst maecenas
11/28/2021,9541,sed ante vivamus tortor duis mattis egestas metus aenean fermentum donec ut mauris
09/21/2016,2980,blandit mi in porttitor pede justo eu massa donec dapibus duis at velit eu est congue elementum in
12/02/2018,7730,pulvinar lobortis est phasellus sit amet erat nulla tempus vivamus in felis eu sapien
03/30/2021,1540,at nunc commodo placerat praesent blandit nam nulla integer pede justo lacinia eget tincidunt eget tempus vel
07/26/2015,2134,nullam varius nulla facilisi cras non velit nec nisi vulputate nonummy maecenas tincidunt lacus at velit
10/25/2017,9755,non velit nec nisi vulputate nonummy maecenas tincidunt lacus at velit vivamus vel nulla
01/16/2015,7916,amet sapien dignissim vestibulum vestibulum ante ipsum primis in faucibus orci luctus et ultrices posuere cubilia curae
05/24/2017,149,neque aenean auctor gravida sem praesent id massa id nisl venenatis lacinia aenean
10/30/2016,2369,at dolor quis odio consequat varius integer ac leo pellentesque ultrices mattis odio donec vitae nisi nam ultrices libero non
09/05/2016,1131,ultrices posuere cubilia curae nulla dapibus dolor vel est donec odio justo sollicitudin ut suscipit a feugiat et eros
03/15/2019,6363,est congue elementum in hac habitasse platea dictumst morbi vestibulum velit id pretium iaculis diam erat fermentum justo
03/10/2019,8838,amet turpis elementum ligula vehicula consequat morbi a ipsum integer
11/17/2018,7066,nunc nisl duis bibendum felis sed interdum venenatis turpis enim blandit mi in porttitor
07/23/2021,8015,sapien non mi integer ac neque duis bibendum morbi non
07/05/2017,9553,interdum in ante vestibulum ante ipsum primis in faucibus orci luctus et ultrices
07/27/2020,8985,ullamcorper purus sit amet nulla quisque arcu libero rutrum ac lobortis vel dapibus at diam
04/12/2016,1608,etiam justo etiam pretium iaculis justo in hac habitasse platea dictumst etiam faucibus cursus urna ut
05/17/2015,3517,vel nulla eget eros elementum pellentesque quisque porta volutpat erat quisque erat eros viverra eget congue eget
01/22/2016,9007,tincidunt ante vel ipsum praesent blandit lacinia erat vestibulum sed magna at nunc commodo placerat praesent blandit nam nulla integer
08/16/2018,135,eget semper rutrum nulla nunc purus phasellus in felis donec
06/27/2017,1548,pellentesque eget nunc donec quis orci eget orci vehicula condimentum curabitur
02/25/2019,9950,quam pede lobortis ligula sit amet eleifend pede libero quis orci nullam molestie nibh
04/14/2021,5648,augue vestibulum ante ipsum primis in faucibus orci luctus et ultrices posuere cubilia
05/10/2015,9100,dictumst morbi vestibulum velit id pretium iaculis diam erat fermentum justo nec condimentum neque sapien placerat ante nulla
04/25/2018,188,at velit eu est congue elementum in hac habitasse platea
07/12/2015,9923,habitasse platea dictumst morbi vestibulum velit id pretium iaculis diam erat fermentum justo nec condimentum neque sapien placerat
06/10/2020,2635,consequat ut nulla sed accumsan felis ut at dolor quis odio
03/21/2020,4649,eros elementum pellentesque quisque porta volutpat erat quisque erat eros viverra eget
01/17/2021,1517,phasellus id sapien in sapien iaculis congue vivamus metus arcu adipiscing molestie hendrerit
07/26/2015,6569,congue etiam justo etiam pretium iaculis justo in hac habitasse platea dictumst etiam faucibus cursus urna ut tellus
10/05/2015,3794,id luctus nec molestie sed justo pellentesque viverra pede ac diam cras pellentesque volutpat dui maecenas tristique est
05/25/2021,8311,justo morbi ut odio cras mi pede malesuada in imperdiet et commodo vulputate justo in blandit
03/22/2018,8812,nisi vulputate nonummy maecenas tincidunt lacus at velit vivamus vel nulla eget eros elementum pellentesque quisque porta
08/01/2016,5569,vel nulla eget eros elementum pellentesque quisque porta volutpat erat quisque erat eros viverra eget congue eget
05/31/2018,8350,praesent blandit nam nulla integer pede justo lacinia eget tincidunt eget tempus vel
04/17/2017,9031,sapien ut nunc vestibulum ante ipsum primis in faucibus orci luctus et ultrices posuere cubilia curae mauris
11/21/2019,3788,non mauris morbi non lectus aliquam sit amet diam in magna bibendum imperdiet nullam orci
11/13/2020,3008,aliquam quis turpis eget elit sodales scelerisque mauris sit amet eros suspendisse accumsan tortor quis turpis sed ante vivamus
02/22/2016,101,duis mattis egestas metus aenean fermentum donec ut mauris eget massa tempor convallis nulla neque libero convallis eget eleifend luctus
05/19/2018,9788,faucibus orci luctus et ultrices posuere cubilia curae nulla dapibus dolor vel est
06/09/2019,5387,urna pretium nisl ut volutpat sapien arcu sed augue aliquam erat volutpat in congue etiam justo etiam pretium iaculis justo
03/08/2020,3061,ligula nec sem duis aliquam convallis nunc proin at turpis a
07/31/2018,544,rutrum nulla tellus in sagittis dui vel nisl duis ac nibh
04/24/2017,7934,ultrices posuere cubilia curae donec pharetra magna vestibulum aliquet ultrices erat tortor sollicitudin mi sit amet lobortis
10/03/2020,7138,venenatis lacinia aenean sit amet justo morbi ut odio cras mi
08/07/2017,7508,iaculis justo in hac habitasse platea dictumst etiam faucibus cursus urna ut tellus nulla ut erat id mauris
07/10/2016,2788,porta volutpat quam pede lobortis ligula sit amet eleifend pede libero quis orci
08/02/2021,9909,faucibus orci luctus et ultrices posuere cubilia curae duis faucibus accumsan odio curabitur convallis duis consequat dui nec nisi
10/30/2019,5452,donec pharetra magna vestibulum aliquet ultrices erat tortor sollicitudin mi sit amet lobortis sapien sapien
03/15/2021,1310,enim leo rhoncus sed vestibulum sit amet cursus id turpis integer aliquet
03/09/2021,3462,tellus nisi eu orci mauris lacinia sapien quis libero nullam sit amet turpis elementum ligula vehicula consequat
04/08/2018,3931,tempor turpis nec euismod scelerisque quam turpis adipiscing lorem vitae mattis nibh ligula nec sem duis aliquam convallis nunc
11/17/2017,5134,amet turpis elementum ligula vehicula consequat morbi a ipsum integer a nibh in quis justo maecenas rhoncus
04/07/2015,6881,nullam varius nulla facilisi cras non velit nec nisi vulputate nonummy maecenas tincidunt lacus at velit
01/26/2021,9841,neque sapien placerat ante nulla justo aliquam quis turpis eget elit sodales scelerisque mauris sit
08/05/2015,6776,tortor sollicitudin mi sit amet lobortis sapien sapien non mi integer ac neque duis bibendum
10/23/2021,1079,ultricies eu nibh quisque id justo sit amet sapien dignissim vestibulum vestibulum ante ipsum primis in
10/01/2019,8933,diam id ornare imperdiet sapien urna pretium nisl ut volutpat sapien arcu
01/20/2015,7812,orci mauris lacinia sapien quis libero nullam sit amet turpis elementum ligula
07/27/2018,819,vitae quam suspendisse potenti nullam porttitor lacus at turpis donec posuere metus vitae ipsum aliquam non mauris morbi
07/23/2017,8111,ultrices mattis odio donec vitae nisi nam ultrices libero non mattis pulvinar nulla pede ullamcorper augue a suscipit nulla
02/03/2017,3377,at nulla suspendisse potenti cras in purus eu magna vulputate luctus cum sociis natoque penatibus et magnis dis
02/25/2017,1479,sed nisl nunc rhoncus dui vel sem sed sagittis nam congue
12/30/2021,217,morbi vestibulum velit id pretium iaculis diam erat fermentum justo nec condimentum neque sapien
01/30/2016,7479,montes nascetur ridiculus mus vivamus vestibulum sagittis sapien cum sociis natoque penatibus
09/08/2017,2787,ullamcorper augue a suscipit nulla elit ac nulla sed vel
07/11/2016,9362,nulla dapibus dolor vel est donec odio justo sollicitudin ut suscipit a
07/11/2016,5036,ligula sit amet eleifend pede libero quis orci nullam molestie nibh in lectus
01/18/2015,2914,mi nulla ac enim in tempor turpis nec euismod scelerisque quam turpis adipiscing lorem vitae mattis
05/02/2021,2187,in sagittis dui vel nisl duis ac nibh fusce lacus purus aliquet at feugiat non pretium
11/25/2020,265,morbi ut odio cras mi pede malesuada in imperdiet et commodo vulputate justo in blandit ultrices enim lorem
01/24/2016,5396,pulvinar sed nisl nunc rhoncus dui vel sem sed sagittis nam congue risus
08/06/2019,4208,nisl venenatis lacinia aenean sit amet justo morbi ut odio cras
06/29/2019,8893,nulla suscipit ligula in lacus curabitur at ipsum ac tellus semper interdum mauris ullamcorper purus sit amet
11/29/2018,4156,lectus in est risus auctor sed tristique in tempus sit amet sem fusce consequat nulla nisl nunc nisl duis bibendum
03/13/2018,7096,sit amet consectetuer adipiscing elit proin interdum mauris non ligula pellentesque ultrices phasellus id sapien in sapien iaculis
11/04/2021,5252,turpis elementum ligula vehicula consequat morbi a ipsum integer a nibh in quis justo maecenas rhoncus aliquam lacus morbi quis
03/15/2019,1855,suspendisse ornare consequat lectus in est risus auctor sed tristique in tempus sit amet sem fusce
01/02/2019,9791,nulla nisl nunc nisl duis bibendum felis sed interdum venenatis turpis enim blandit
08/07/2020,7397,convallis nulla neque libero convallis eget eleifend luctus ultricies eu
08/15/2021,8383,dolor sit amet consectetuer adipiscing elit proin risus praesent lectus vestibulum quam sapien
11/25/2016,3413,duis mattis egestas metus aenean fermentum donec ut mauris eget massa tempor convallis nulla neque libero convallis eget eleifend luctus
07/18/2020,753,sapien ut nunc vestibulum ante ipsum primis in faucibus orci luctus et ultrices posuere cubilia curae mauris viverra diam
02/01/2016,7931,ullamcorper purus sit amet nulla quisque arcu libero rutrum ac lobortis vel dapibus
01/01/2015,2504,lobortis ligula sit amet eleifend pede libero quis orci nullam molestie nibh in lectus pellentesque at nulla suspendisse potenti cras
11/25/2015,5208,in lacus curabitur at ipsum ac tellus semper interdum mauris ullamcorper purus
10/12/2018,7739,orci eget orci vehicula condimentum curabitur in libero ut massa volutpat convallis morbi odio odio elementum eu interdum eu
01/31/2016,7936,pellentesque volutpat dui maecenas tristique est et tempus semper est quam pharetra magna ac consequat metus sapien ut nunc vestibulum
11/21/2020,7080,sodales sed tincidunt eu felis fusce posuere felis sed lacus morbi sem mauris
08/04/2021,3416,non interdum in ante vestibulum ante ipsum primis in faucibus orci luctus et ultrices posuere cubilia
11/23/2015,4097,nec sem duis aliquam convallis nunc proin at turpis a pede posuere nonummy integer non velit
01/30/2018,2593,gravida nisi at nibh in hac habitasse platea dictumst aliquam augue quam sollicitudin vitae consectetuer eget rutrum at lorem integer
05/30/2020,321,lobortis est phasellus sit amet erat nulla tempus vivamus in felis eu sapien cursus vestibulum proin eu mi nulla
11/22/2018,6883,nibh in lectus pellentesque at nulla suspendisse potenti cras in purus eu magna vulputate luctus cum
01/26/2018,7519,posuere cubilia curae nulla dapibus dolor vel est donec odio justo sollicitudin ut suscipit
11/17/2018,3194,nunc donec quis orci eget orci vehicula condimentum curabitur in libero ut massa volutpat convallis morbi odio odio
10/09/2016,3756,orci luctus et ultrices posuere cubilia curae mauris viverra diam vitae quam suspendisse potenti nullam
10/27/2020,8897,sem mauris laoreet ut rhoncus aliquet pulvinar sed nisl nunc rhoncus dui vel sem sed sagittis nam
07/23/2021,4814,nibh ligula nec sem duis aliquam convallis nunc proin at
06/06/2020,8909,nulla pede ullamcorper augue a suscipit nulla elit ac nulla sed vel enim sit amet nunc viverra dapibus nulla
02/22/2021,4059,vel sem sed sagittis nam congue risus semper porta volutpat
08/11/2017,7498,blandit lacinia erat vestibulum sed magna at nunc commodo placerat praesent blandit nam nulla
08/25/2015,1452,leo maecenas pulvinar lobortis est phasellus sit amet erat nulla tempus vivamus in felis eu sapien cursus vestibulum proin eu
06/19/2018,290,vestibulum ante ipsum primis in faucibus orci luctus et ultrices posuere cubilia curae nulla dapibus
10/01/2016,8360,lacinia erat vestibulum sed magna at nunc commodo placerat praesent blandit nam nulla integer pede
07/09/2015,5572,primis in faucibus orci luctus et ultrices posuere cubilia curae nulla dapibus dolor vel est donec odio
05/10/2021,3660,luctus cum sociis natoque penatibus et magnis dis parturient montes nascetur ridiculus mus vivamus
12/10/2019,472,neque aenean auctor gravida sem praesent id massa id nisl venenatis lacinia aenean sit amet justo morbi ut odio
04/11/2020,984,vulputate justo in blandit ultrices enim lorem ipsum dolor sit amet
04/20/2019,7095,semper porta volutpat quam pede lobortis ligula sit amet eleifend pede libero quis orci nullam
11/09/2015,9391,posuere cubilia curae duis faucibus accumsan odio curabitur convallis duis consequat dui nec nisi volutpat
01/24/2018,2426,consequat metus sapien ut nunc vestibulum ante ipsum primis in faucibus orci luctus et ultrices posuere cubilia
11/13/2018,8552,elementum eu interdum eu tincidunt in leo maecenas pulvinar lobortis est phasellus sit amet erat nulla tempus
08/26/2016,264,sed nisl nunc rhoncus dui vel sem sed sagittis nam congue risus
10/16/2019,4200,at feugiat non pretium quis lectus suspendisse potenti in eleifend quam a odio
07/15/2021,6112,eleifend quam a odio in hac habitasse platea dictumst maecenas ut massa quis augue
07/03/2018,9336,velit donec diam neque vestibulum eget vulputate ut ultrices vel augue vestibulum ante
09/06/2017,8644,vestibulum velit id pretium iaculis diam erat fermentum justo nec
11/05/2016,2613,hendrerit at vulputate vitae nisl aenean lectus pellentesque eget nunc donec quis orci
08/01/2019,4588,molestie lorem quisque ut erat curabitur gravida nisi at nibh in hac habitasse
06/16/2020,5335,turpis elementum ligula vehicula consequat morbi a ipsum integer a nibh in quis justo maecenas rhoncus aliquam lacus morbi
08/30/2015,7399,eget congue eget semper rutrum nulla nunc purus phasellus in felis donec semper sapien a libero nam dui proin leo
01/07/2017,4645,diam cras pellentesque volutpat dui maecenas tristique est et tempus semper est quam
04/10/2015,1481,diam vitae quam suspendisse potenti nullam porttitor lacus at turpis donec posuere metus vitae ipsum aliquam
07/22/2017,5314,ullamcorper augue a suscipit nulla elit ac nulla sed vel enim sit amet nunc
05/27/2017,5594,sapien ut nunc vestibulum ante ipsum primis in faucibus orci luctus et ultrices posuere
05/03/2019,8135,eu tincidunt in leo maecenas pulvinar lobortis est phasellus sit amet erat nulla tempus vivamus in felis
10/14/2021,4876,sapien varius ut blandit non interdum in ante vestibulum ante ipsum primis in faucibus orci luctus et ultrices
04/02/2019,7655,neque libero convallis eget eleifend luctus ultricies eu nibh quisque id justo sit amet sapien dignissim vestibulum vestibulum ante
05/12/2018,4672,aenean sit amet justo morbi ut odio cras mi pede
05/21/2015,5125,nulla neque libero convallis eget eleifend luctus ultricies eu nibh quisque id justo sit amet sapien dignissim vestibulum vestibulum
08/24/2017,1564,sociis natoque penatibus et magnis dis parturient montes nascetur ridiculus mus etiam
05/14/2017,7488,est quam pharetra magna ac consequat metus sapien ut nunc vestibulum ante ipsum primis in
09/07/2017,6474,nisl nunc rhoncus dui vel sem sed sagittis nam congue
04/26/2018,6716,iaculis congue vivamus metus arcu adipiscing molestie hendrerit at vulputate
01/03/2017,7109,morbi vestibulum velit id pretium iaculis diam erat fermentum justo nec condimentum neque sapien placerat ante nulla justo aliquam quis
02/14/2020,5860,bibendum morbi non quam nec dui luctus rutrum nulla tellus in sagittis
06/14/2015,5725,nulla sed accumsan felis ut at dolor quis odio consequat varius integer ac leo pellentesque
11/07/2019,4480,nunc donec quis orci eget orci vehicula condimentum curabitur in
12/26/2015,5009,sed nisl nunc rhoncus dui vel sem sed sagittis nam congue risus semper porta volutpat quam pede
02/19/2020,156,in imperdiet et commodo vulputate justo in blandit ultrices enim lorem
08/02/2021,2384,in faucibus orci luctus et ultrices posuere cubilia curae mauris viverra diam vitae quam suspendisse potenti nullam porttitor lacus at
08/04/2016,8141,elit sodales scelerisque mauris sit amet eros suspendisse accumsan tortor quis turpis sed ante
06/10/2020,2268,lacus morbi quis tortor id nulla ultrices aliquet maecenas leo odio
02/29/2016,6454,amet nulla quisque arcu libero rutrum ac lobortis vel dapibus at diam nam tristique tortor
03/16/2015,7666,quisque erat eros viverra eget congue eget semper rutrum nulla nunc purus phasellus in felis donec semper sapien
04/23/2018,4676,orci luctus et ultrices posuere cubilia curae duis faucibus accumsan odio curabitur convallis duis consequat dui nec nisi volutpat eleifend
06/22/2021,4545,nulla pede ullamcorper augue a suscipit nulla elit ac nulla sed vel enim sit amet
03/09/2015,234,rhoncus aliquam lacus morbi quis tortor id nulla ultrices aliquet maecenas leo odio condimentum id luctus nec molestie sed justo
12/21/2017,5253,consectetuer adipiscing elit proin risus praesent lectus vestibulum quam sapien varius
04/15/2017,914,tempor convallis nulla neque libero convallis eget eleifend luctus ultricies eu nibh quisque id justo sit amet sapien dignissim
06/01/2019,1599,ante ipsum primis in faucibus orci luctus et ultrices posuere cubilia curae mauris viverra diam
11/15/2020,1021,sed augue aliquam erat volutpat in congue etiam justo etiam
10/03/2016,8084,varius nulla facilisi cras non velit nec nisi vulputate nonummy maecenas tincidunt
09/07/2015,8726,id sapien in sapien iaculis congue vivamus metus arcu adipiscing molestie hendrerit at vulputate vitae
12/17/2015,993,fusce congue diam id ornare imperdiet sapien urna pretium nisl ut volutpat sapien arcu sed augue
12/06/2018,6432,vulputate elementum nullam varius nulla facilisi cras non velit nec nisi vulputate
11/28/2017,5780,ridiculus mus vivamus vestibulum sagittis sapien cum sociis natoque penatibus
06/21/2017,6024,et commodo vulputate justo in blandit ultrices enim lorem ipsum dolor sit amet
04/28/2018,3701,proin interdum mauris non ligula pellentesque ultrices phasellus id sapien in sapien iaculis congue vivamus metus arcu adipiscing molestie
08/04/2016,3147,faucibus orci luctus et ultrices posuere cubilia curae nulla dapibus dolor vel est donec
04/21/2015,9534,donec posuere metus vitae ipsum aliquam non mauris morbi non lectus aliquam sit
05/23/2018,2189,luctus et ultrices posuere cubilia curae donec pharetra magna vestibulum aliquet ultrices
11/28/2015,7969,tincidunt eu felis fusce posuere felis sed lacus morbi sem mauris laoreet
08/13/2019,901,est congue elementum in hac habitasse platea dictumst morbi vestibulum velit id pretium iaculis diam erat fermentum
01/17/2017,8470,dictumst maecenas ut massa quis augue luctus tincidunt nulla mollis molestie lorem quisque ut erat curabitur gravida
02/24/2015,4217,in sagittis dui vel nisl duis ac nibh fusce lacus purus aliquet at feugiat non pretium quis
05/06/2018,2953,amet turpis elementum ligula vehicula consequat morbi a ipsum integer a nibh
05/12/2018,5430,posuere felis sed lacus morbi sem mauris laoreet ut rhoncus aliquet pulvinar sed nisl nunc rhoncus dui vel sem sed
03/16/2021,6163,sit amet cursus id turpis integer aliquet massa id lobortis convallis
04/27/2016,6677,sagittis nam congue risus semper porta volutpat quam pede lobortis ligula sit amet eleifend
03/27/2015,7590,faucibus orci luctus et ultrices posuere cubilia curae donec pharetra magna vestibulum aliquet ultrices erat tortor sollicitudin
08/18/2019,2549,enim sit amet nunc viverra dapibus nulla suscipit ligula in lacus curabitur at ipsum ac tellus semper interdum
02/04/2016,9130,neque aenean auctor gravida sem praesent id massa id nisl venenatis
10/12/2019,1772,justo morbi ut odio cras mi pede malesuada in imperdiet et commodo vulputate justo in blandit ultrices enim
06/23/2020,4948,ridiculus mus etiam vel augue vestibulum rutrum rutrum neque aenean auctor gravida
12/23/2020,2331,in porttitor pede justo eu massa donec dapibus duis at velit eu est congue elementum in hac habitasse platea dictumst
11/20/2018,5298,aliquam quis turpis eget elit sodales scelerisque mauris sit amet eros suspendisse accumsan
09/26/2020,8271,non mi integer ac neque duis bibendum morbi non quam nec dui luctus
07/20/2020,6320,felis fusce posuere felis sed lacus morbi sem mauris laoreet ut rhoncus aliquet pulvinar
06/30/2017,3679,amet lobortis sapien sapien non mi integer ac neque duis bibendum morbi non quam nec
08/11/2021,9791,nibh fusce lacus purus aliquet at feugiat non pretium quis lectus suspendisse potenti in eleifend quam a odio in hac
02/02/2020,3202,semper est quam pharetra magna ac consequat metus sapien ut nunc vestibulum ante ipsum primis in
03/05/2021,5552,in lacus curabitur at ipsum ac tellus semper interdum mauris ullamcorper purus sit amet nulla quisque arcu
08/18/2015,6428,convallis nunc proin at turpis a pede posuere nonummy integer non velit donec diam neque vestibulum eget
02/26/2015,562,luctus et ultrices posuere cubilia curae duis faucibus accumsan odio curabitur
07/20/2020,6448,cursus urna ut tellus nulla ut erat id mauris vulputate elementum nullam varius nulla facilisi cras non velit nec nisi
10/02/2015,6213,etiam faucibus cursus urna ut tellus nulla ut erat id
10/23/2016,6077,pretium iaculis justo in hac habitasse platea dictumst etiam faucibus cursus urna
07/24/2021,6081,rhoncus sed vestibulum sit amet cursus id turpis integer aliquet massa id lobortis
03/15/2021,3176,non sodales sed tincidunt eu felis fusce posuere felis sed lacus
11/13/2021,7585,cubilia curae duis faucibus accumsan odio curabitur convallis duis consequat dui nec nisi volutpat
