06/14/2018,1507,cubilia curae duis faucibus accumsan odio curabitur convallis duis consequat dui nec nisi volutpat eleifend donec ut dolor morbi vel
03/27/2018,7933,aenean fermentum donec ut mauris eget massa tempor convallis nulla neque libero
05/03/2015,3391,ipsum primis in faucibus orci luctus et ultrices posuere cubilia curae donec pharetra magna
04/03/2018,9781,feugiat et eros vestibulum ac est lacinia nisi venenatis tristique fusce congue diam id ornare imperdiet
03/23/2017,9746,pellentesque at nulla suspendisse potenti cras in purus eu magna vulputate luctus cum sociis natoque penatibus et
10/28/2017,7793,diam neque vestibulum eget vulputate ut ultrices vel augue vestibulum ante ipsum
04/02/2018,3135,duis aliquam convallis nunc proin at turpis a pede posuere nonummy integer
06/09/2018,5693,libero quis orci nullam molestie nibh in lectus pellentesque at nulla suspendisse potenti cras in purus
12/10/2021,5355,tellus in sagittis dui vel nisl duis ac nibh fusce lacus purus aliquet at feugiat non
11/26/2018,6556,dui vel sem sed sagittis nam congue risus semper porta
10/09/2018,1259,augue quam sollicitudin vitae consectetuer eget rutrum at lorem integer tincidunt ante vel ipsum
01/13/2015,5576,sit amet justo morbi ut odio cras mi pede malesuada in imperdiet et
07/03/2016,6359,ut nulla sed accumsan felis ut at dolor quis odio consequat varius integer ac
09/17/2020,4963,nisi volutpat eleifend donec ut dolor morbi vel lectus in quam fringilla
05/19/2021,8213,est phasellus sit amet erat nulla tempus vivamus in felis eu sapien cursus vestibulum proin eu mi nulla ac enim
08/13/2021,7772,nulla suspendisse potenti cras in purus eu magna vulputate luctus cum sociis natoque penatibus et magnis
03/21/2016,1498,faucibus orci luctus et ultrices posuere cubilia curae mauris viverra diam vitae quam suspendisse potenti nullam porttitor lacus
03/25/2015,3745,donec pharetra magna vestibulum aliquet ultrices erat tortor sollicitudin mi sit amet lobortis sapien
09/16/2020,2508,a pede posuere nonummy integer non velit donec diam neque vestibulum eget vulputate ut ultrices vel augue vestibulum ante ipsum
11/09/2019,6012,enim sit amet nunc viverra dapibus nulla suscipit ligula in lacus curabitur at ipsum ac tellus semper interdum mauris
04/13/2018,4180,commodo placerat praesent blandit nam nulla integer pede justo lacinia eget tincidunt eget tempus vel pede morbi porttitor lorem id
02/18/2020,5178,sapien a libero nam dui proin leo odio porttitor id consequat in consequat ut nulla sed accumsan
02/13/2020,244,sapien dignissim vestibulum vestibulum ante ipsum primis in faucibus orci luctus et ultrices posuere cubilia curae nulla
11/16/2021,176,justo aliquam quis turpis eget elit sodales scelerisque mauris sit amet eros suspendisse accumsan tortor quis turpis sed
10/08/2019,8438,diam id ornare imperdiet sapien urna pretium nisl ut volutpat
01/03/2017,7996,suscipit ligula in lacus curabitur at ipsum ac tellus semper interdum mauris ullamcorper purus
05/28/2019,5833,dui nec nisi volutpat eleifend donec ut dolor morbi vel lectus
02/01/2019,2646,curabitur gravida nisi at nibh in hac habitasse platea dictumst aliquam augue quam sollicitudin vitae consectetuer eget rutrum at lorem
12/20/2016,8829,amet lobortis sapien sapien non mi integer ac neque duis bibendum morbi non quam
02/12/2018,5965,eu sapien cursus vestibulum proin eu mi nulla ac enim in tempor turpis nec euismod scelerisque
08/12/2015,1248,donec ut dolor morbi vel lectus in quam fringilla rhoncus mauris enim leo rhoncus sed vestibulum sit
09/01/2020,2355,posuere cubilia curae duis faucibus accumsan odio curabitur convallis duis consequat dui nec nisi volutpat eleifend donec ut dolor
02/09/2015,8854,justo sit amet sapien dignissim vestibulum vestibulum ante ipsum primis in faucibus orci
05/09/2015,9887,tortor id nulla ultrices aliquet maecenas leo odio condimentum id luctus nec molestie sed justo pellentesque
10/29/2018,5371,mauris laoreet ut rhoncus aliquet pulvinar sed nisl nunc rhoncus dui vel sem sed sagittis nam
08/21/2015,4229,at vulputate vitae nisl aenean lectus pellentesque eget nunc donec quis orci eget orci
02/09/2015,4386,vestibulum ante ipsum primis in faucibus orci luctus et ultrices posuere cubilia curae mauris viverra diam vitae quam suspendisse
06/25/2020,1354,id mauris vulputate elementum nullam varius nulla facilisi cras non velit nec nisi vulputate nonummy
10/11/2018,5739,justo lacinia eget tincidunt eget tempus vel pede morbi porttitor lorem
04/19/2019,1835,magnis dis parturient montes nascetur ridiculus mus vivamus vestibulum sagittis sapien cum sociis natoque penatibus et magnis dis parturient
12/30/2020,5224,sem fusce consequat nulla nisl nunc nisl duis bibendum felis sed interdum venenatis turpis enim blandit mi in porttitor
09/17/2020,6515,nonummy maecenas tincidunt lacus at velit vivamus vel nulla eget eros elementum pellentesque quisque porta
08/08/2019,9427,ligula vehicula consequat morbi a ipsum integer a nibh in quis justo maecenas rhoncus aliquam lacus morbi quis tortor id
03/11/2017,9354,sed interdum venenatis turpis enim blandit mi in porttitor pede justo eu massa donec dapibus duis at velit eu est
10/25/2016,9637,aliquet massa id lobortis convallis tortor risus dapibus augue vel accumsan tellus nisi
08/19/2017,3813,vestibulum eget vulputate ut ultrices vel augue vestibulum ante ipsum primis in faucibus orci luctus et
08/13/2018,311,aliquam lacus morbi quis tortor id nulla ultrices aliquet maecenas leo
01/25/2019,2008,amet diam in magna bibendum imperdiet nullam orci pede venenatis non sodales sed
09/18/2021,8406,pharetra magna ac consequat metus sapien ut nunc vestibulum ante ipsum primis in faucibus orci luctus et
01/31/2018,603,mus vivamus vestibulum sagittis sapien cum sociis natoque penatibus et magnis dis parturient montes nascetur ridiculus
03/16/2021,6886,convallis tortor risus dapibus augue vel accumsan tellus nisi eu orci
03/17/2016,353,iaculis congue vivamus metus arcu adipiscing molestie hendrerit at vulputate vitae nisl aenean lectus pellentesque eget nunc
01/20/2020,4084,dapibus dolor vel est donec odio justo sollicitudin ut suscipit a
03/24/2020,4962,curae donec pharetra magna vestibulum aliquet ultrices erat tortor sollicitudin mi sit amet lobortis sapien sapien
10/28/2017,9615,commodo placerat praesent blandit nam nulla integer pede justo lacinia eget tincidunt
04/02/2018,8373,blandit nam nulla integer pede justo lacinia eget tincidunt eget tempus vel pede morbi porttitor lorem id
04/22/2016,2849,non mattis pulvinar nulla pede ullamcorper augue a suscipit nulla elit ac nulla sed
10/06/2018,2816,cursus urna ut tellus nulla ut erat id mauris vulputate elementum nullam varius nulla facilisi cras non velit
04/05/2021,1135,mauris enim leo rhoncus sed vestibulum sit amet cursus id turpis integer aliquet massa id lobortis convallis tortor risus
06/23/2017,160,cras pellentesque volutpat dui maecenas tristique est et tempus semper est quam pharetra magna ac consequat
05/01/2017,6370,vel augue vestibulum rutrum rutrum neque aenean auctor gravida sem praesent id massa id nisl venenatis lacinia aenean
02/26/2015,9455,luctus nec molestie sed justo pellentesque viverra pede ac diam cras pellentesque volutpat dui
10/03/2020,6665,congue risus semper porta volutpat quam pede lobortis ligula sit
12/25/2019,2399,congue vivamus metus arcu adipiscing molestie hendrerit at vulputate vitae nisl aenean lectus pellentesque eget nunc donec
07/29/2015,3268,nunc commodo placerat praesent blandit nam nulla integer pede justo lacinia
11/26/2016,8142,ultrices mattis odio donec vitae nisi nam ultrices libero non mattis pulvinar nulla pede ullamcorper augue a suscipit nulla elit
09/17/2017,9366,elit ac nulla sed vel enim sit amet nunc viverra dapibus nulla suscipit
03/22/2017,1683,luctus cum sociis natoque penatibus et magnis dis parturient montes
12/15/2021,4778,luctus et ultrices posuere cubilia curae donec pharetra magna vestibulum
03/26/2019,3754,augue vestibulum ante ipsum primis in faucibus orci luctus et ultrices posuere cubilia curae donec pharetra magna vestibulum aliquet
03/06/2018,6156,rhoncus sed vestibulum sit amet cursus id turpis integer aliquet massa
05/01/2019,4515,platea dictumst maecenas ut massa quis augue luctus tincidunt nulla mollis molestie lorem
08/11/2020,6608,etiam vel augue vestibulum rutrum rutrum neque aenean auctor gravida sem praesent id massa id nisl venenatis lacinia
01/13/2019,1468,erat tortor sollicitudin mi sit amet lobortis sapien sapien non
01/18/2018,7964,in imperdiet et commodo vulputate justo in blandit ultrices enim lorem
06/24/2017,6251,nibh in hac habitasse platea dictumst aliquam augue quam sollicitudin vitae consectetuer eget rutrum at lorem
05/21/2021,1285,phasellus sit amet erat nulla tempus vivamus in felis eu
06/05/2020,7553,orci nullam molestie nibh in lectus pellentesque at nulla suspendisse potenti cras in purus eu magna vulputate luctus
12/14/2016,8072,integer a nibh in quis justo maecenas rhoncus aliquam lacus morbi
09/24/2021,4019,vulputate ut ultrices vel augue vestibulum ante ipsum primis in faucibus orci luctus et ultrices posuere cubilia curae donec
12/05/2018,5217,morbi non lectus aliquam sit amet diam in magna bibendum imperdiet nullam orci pede venenatis non sodales sed tincidunt
11/01/2016,7454,sapien sapien non mi integer ac neque duis bibendum morbi non quam nec dui luctus rutrum nulla tellus
09/01/2020,2968,purus phasellus in felis donec semper sapien a libero nam dui proin leo
06/13/2017,5692,metus vitae ipsum aliquam non mauris morbi non lectus aliquam sit amet diam
09/10/2019,736,libero nam dui proin leo odio porttitor id consequat in consequat ut nulla sed accumsan felis ut at
10/19/2017,1169,tellus semper interdum mauris ullamcorper purus sit amet nulla quisque arcu libero rutrum
03/22/2016,3239,congue eget semper rutrum nulla nunc purus phasellus in felis donec semper sapien
01/28/2021,4096,massa quis augue luctus tincidunt nulla mollis molestie lorem quisque
12/05/2018,256,orci vehicula condimentum curabitur in libero ut massa volutpat convallis morbi odio odio elementum
12/24/2016,702,sed tincidunt eu felis fusce posuere felis sed lacus morbi sem
06/14/2018,1424,vestibulum proin eu mi nulla ac enim in tempor turpis nec euismod scelerisque quam turpis adipiscing lorem vitae mattis nibh
11/08/2017,348,tincidunt in leo maecenas pulvinar lobortis est phasellus sit amet erat nulla tempus
04/02/2018,6167,purus sit amet nulla quisque arcu libero rutrum ac lobortis vel dapibus at
06/09/2016,7476,vulputate nonummy maecenas tincidunt lacus at velit vivamus vel nulla eget eros
06/21/2017,6375,sollicitudin mi sit amet lobortis sapien sapien non mi integer ac neque duis
06/30/2020,4650,proin at turpis a pede posuere nonummy integer non velit donec diam
02/04/2021,8636,potenti cras in purus eu magna vulputate luctus cum sociis natoque penatibus et
02/08/2017,8456,at dolor quis odio consequat varius integer ac leo pellentesque ultrices mattis odio
01/20/2018,7424,orci luctus et ultrices posuere cubilia curae mauris viverra diam vitae quam suspendisse potenti nullam porttitor lacus at turpis
11/18/2021,5250,vestibulum velit id pretium iaculis diam erat fermentum justo nec condimentum neque sapien placerat ante nulla justo
08/31/2017,3533,cursus urna ut tellus nulla ut erat id mauris vulputate elementum nullam varius nulla facilisi cras
04/13/2017,2752,sed tristique in tempus sit amet sem fusce consequat nulla nisl nunc nisl duis bibendum
03/21/2016,4064,mattis egestas metus aenean fermentum donec ut mauris eget massa tempor convallis nulla neque libero convallis eget eleifend luctus
06/27/2015,4884,praesent blandit nam nulla integer pede justo lacinia eget tincidunt eget tempus vel pede morbi porttitor lorem
12/10/2015,9016,purus sit amet nulla quisque arcu libero rutrum ac lobortis vel dapibus at diam nam tristique
09/16/2021,3749,augue luctus tincidunt nulla mollis molestie lorem quisque ut erat curabitur gravida nisi at nibh in hac
07/12/2019,5558,elementum nullam varius nulla facilisi cras non velit nec nisi vulputate nonummy maecenas
04/10/2018,9878,eget congue eget semper rutrum nulla nunc purus phasellus in
12/22/2017,1953,praesent lectus vestibulum quam sapien varius ut blandit non interdum in ante vestibulum ante ipsum primis
11/23/2020,9677,lectus pellentesque eget nunc donec quis orci eget orci vehicula condimentum curabitur in
02/23/2018,6981,lectus suspendisse potenti in eleifend quam a odio in hac habitasse platea
02/01/2017,8108,vestibulum ante ipsum primis in faucibus orci luctus et ultrices
06/06/2017,7473,elementum eu interdum eu tincidunt in leo maecenas pulvinar lobortis est phasellus sit amet erat nulla tempus vivamus
11/29/2020,2796,sollicitudin vitae consectetuer eget rutrum at lorem integer tincidunt ante vel ipsum praesent blandit lacinia
11/22/2015,7744,lectus vestibulum quam sapien varius ut blandit non interdum in ante vestibulum ante ipsum
01/25/2016,6464,dui proin leo odio porttitor id consequat in consequat ut nulla sed accumsan
06/06/2018,6157,massa volutpat convallis morbi odio odio elementum eu interdum eu tincidunt in leo maecenas pulvinar lobortis est phasellus sit amet
07/25/2019,131,blandit nam nulla integer pede justo lacinia eget tincidunt eget tempus vel pede
08/12/2020,2875,sapien cursus vestibulum proin eu mi nulla ac enim in tempor turpis nec euismod scelerisque quam turpis adipiscing lorem vitae
03/26/2021,5881,dis parturient montes nascetur ridiculus mus vivamus vestibulum sagittis sapien cum sociis natoque penatibus et magnis dis parturient
07/20/2020,3992,ornare imperdiet sapien urna pretium nisl ut volutpat sapien arcu sed augue aliquam erat volutpat in
04/18/2018,7261,tortor risus dapibus augue vel accumsan tellus nisi eu orci
06/26/2018,5354,platea dictumst maecenas ut massa quis augue luctus tincidunt nulla mollis molestie lorem quisque ut erat curabitur gravida nisi
07/01/2021,8730,posuere cubilia curae donec pharetra magna vestibulum aliquet ultrices erat tortor sollicitudin mi sit amet lobortis
04/02/2019,5462,sed justo pellentesque viverra pede ac diam cras pellentesque volutpat dui maecenas tristique est et tempus semper est quam pharetra
05/16/2019,783,mauris lacinia sapien quis libero nullam sit amet turpis elementum ligula vehicula consequat morbi a ipsum integer a
02/11/2020,6618,commodo vulputate justo in blandit ultrices enim lorem ipsum dolor sit amet consectetuer adipiscing elit proin interdum mauris non ligula
01/21/2018,1073,mauris vulputate elementum nullam varius nulla facilisi cras non velit
01/25/2021,6654,luctus ultricies eu nibh quisque id justo sit amet sapien dignissim
01/10/2020,2132,volutpat eleifend donec ut dolor morbi vel lectus in quam fringilla rhoncus mauris enim leo
01/01/2016,7289,mauris laoreet ut rhoncus aliquet pulvinar sed nisl nunc rhoncus dui vel sem sed
10/03/2020,9829,cubilia curae mauris viverra diam vitae quam suspendisse potenti nullam porttitor
10/22/2020,2841,faucibus orci luctus et ultrices posuere cubilia curae donec pharetra magna vestibulum aliquet ultrices erat tortor sollicitudin
04/20/2018,8693,vestibulum sit amet cursus id turpis integer aliquet massa id lobortis convallis tortor risus dapibus augue vel accumsan tellus nisi
12/10/2018,5426,ligula suspendisse ornare consequat lectus in est risus auctor sed tristique in tempus sit amet sem
03/09/2015,2560,id sapien in sapien iaculis congue vivamus metus arcu adipiscing molestie hendrerit at vulputate
07/24/2020,8362,accumsan odio curabitur convallis duis consequat dui nec nisi volutpat eleifend donec ut dolor morbi
12/23/2017,9286,ut massa volutpat convallis morbi odio odio elementum eu interdum eu tincidunt in leo maecenas pulvinar lobortis est phasellus
06/18/2016,2443,rhoncus sed vestibulum sit amet cursus id turpis integer aliquet massa id lobortis convallis tortor risus dapibus
05/28/2020,6216,parturient montes nascetur ridiculus mus etiam vel augue vestibulum rutrum rutrum
05/31/2016,521,erat quisque erat eros viverra eget congue eget semper rutrum nulla nunc purus phasellus in felis donec semper sapien a
03/09/2018,9643,ornare imperdiet sapien urna pretium nisl ut volutpat sapien arcu sed augue aliquam erat volutpat in congue etiam justo
04/15/2021,273,nulla integer pede justo lacinia eget tincidunt eget tempus vel pede morbi porttitor
08/16/2019,7488,a feugiat et eros vestibulum ac est lacinia nisi venenatis tristique fusce congue diam id ornare imperdiet sapien
05/02/2020,4269,faucibus orci luctus et ultrices posuere cubilia curae duis faucibus accumsan odio curabitur convallis duis
04/03/2021,6028,potenti nullam porttitor lacus at turpis donec posuere metus vitae ipsum aliquam non mauris morbi
12/30/2018,286,rutrum nulla nunc purus phasellus in felis donec semper sapien a libero
11/21/2018,2820,commodo vulputate justo in blandit ultrices enim lorem ipsum dolor sit amet
10/22/2017,5313,id ligula suspendisse ornare consequat lectus in est risus auctor sed tristique in tempus sit amet sem fusce consequat
10/06/2021,4675,consectetuer adipiscing elit proin interdum mauris non ligula pellentesque ultrices phasellus id sapien
10/14/2016,2008,enim in tempor turpis nec euismod scelerisque quam turpis adipiscing lorem vitae mattis
05/07/2021,8176,in blandit ultrices enim lorem ipsum dolor sit amet consectetuer adipiscing elit proin interdum mauris non
06/19/2016,915,nullam molestie nibh in lectus pellentesque at nulla suspendisse potenti cras in purus eu magna vulputate luctus cum
05/07/2017,5256,dui nec nisi volutpat eleifend donec ut dolor morbi vel lectus in quam fringilla
12/27/2020,1410,condimentum curabitur in libero ut massa volutpat convallis morbi odio odio elementum eu interdum eu
02/07/2016,3257,mauris non ligula pellentesque ultrices phasellus id sapien in sapien iaculis congue vivamus metus arcu
07/28/2018,8601,elementum ligula vehicula consequat morbi a ipsum integer a nibh in quis justo
03/31/2021,2075,quis augue luctus tincidunt nulla mollis molestie lorem quisque ut erat curabitur gravida nisi at
06/20/2019,8069,dis parturient montes nascetur ridiculus mus vivamus vestibulum sagittis sapien cum sociis natoque
08/26/2016,9137,vulputate ut ultrices vel augue vestibulum ante ipsum primis in faucibus orci
01/08/2020,8257,egestas metus aenean fermentum donec ut mauris eget massa tempor convallis nulla neque libero convallis eget eleifend luctus
08/29/2020,3222,integer a nibh in quis justo maecenas rhoncus aliquam lacus morbi quis tortor id nulla ultrices
11/14/2018,2331,vel pede morbi porttitor lorem id ligula suspendisse ornare consequat lectus in est risus auctor
10/03/2016,112,ipsum primis in faucibus orci luctus et ultrices posuere cubilia curae mauris viverra
02/17/2019,6962,pede libero quis orci nullam molestie nibh in lectus pellentesque at nulla suspendisse potenti cras in purus eu magna vulputate
10/24/2016,9090,nisi eu orci mauris lacinia sapien quis libero nullam sit amet turpis elementum ligula vehicula consequat morbi a
11/16/2017,1828,curabitur convallis duis consequat dui nec nisi volutpat eleifend donec ut dolor
11/16/2018,5545,nisl nunc rhoncus dui vel sem sed sagittis nam congue risus semper porta volutpat quam pede
05/14/2016,9083,lectus in est risus auctor sed tristique in tempus sit amet sem fusce consequat nulla
10/30/2015,548,dui vel nisl duis ac nibh fusce lacus purus aliquet at feugiat
02/24/2018,5079,erat eros viverra eget congue eget semper rutrum nulla nunc purus phasellus in felis donec
11/12/2021,6790,aliquam erat volutpat in congue etiam justo etiam pretium iaculis justo
10/24/2021,4456,adipiscing elit proin interdum mauris non ligula pellentesque ultrices phasellus id sapien in sapien iaculis congue vivamus metus
09/20/2017,5445,donec vitae nisi nam ultrices libero non mattis pulvinar nulla pede ullamcorper augue a suscipit nulla elit ac
06/29/2021,2664,platea dictumst aliquam augue quam sollicitudin vitae consectetuer eget rutrum at lorem integer
06/21/2020,3505,id turpis integer aliquet massa id lobortis convallis tortor risus dapibus augue vel accumsan tellus
01/13/2015,1072,lectus pellentesque at nulla suspendisse potenti cras in purus eu magna vulputate luctus cum sociis natoque penatibus et magnis
07/17/2021,4169,nisl venenatis lacinia aenean sit amet justo morbi ut odio cras mi pede malesuada in imperdiet
08/21/2015,7332,aenean lectus pellentesque eget nunc donec quis orci eget orci vehicula condimentum
05/24/2016,8179,id pretium iaculis diam erat fermentum justo nec condimentum neque sapien placerat ante nulla justo aliquam
09/20/2020,401,nibh fusce lacus purus aliquet at feugiat non pretium quis
06/10/2016,3722,habitasse platea dictumst etiam faucibus cursus urna ut tellus nulla ut erat id mauris
11/11/2018,745,consequat morbi a ipsum integer a nibh in quis justo maecenas rhoncus aliquam
09/11/2016,4956,arcu sed augue aliquam erat volutpat in congue etiam justo etiam pretium iaculis
10/06/2019,4060,ac diam cras pellentesque volutpat dui maecenas tristique est et tempus semper est quam pharetra
10/23/2020,186,neque vestibulum eget vulputate ut ultrices vel augue vestibulum ante ipsum primis in faucibus orci luctus
09/21/2015,5478,scelerisque quam turpis adipiscing lorem vitae mattis nibh ligula nec
10/06/2015,3054,euismod scelerisque quam turpis adipiscing lorem vitae mattis nibh ligula nec sem duis aliquam convallis nunc proin
05/24/2020,4974,lacus at velit vivamus vel nulla eget eros elementum pellentesque
11/08/2020,6664,mi integer ac neque duis bibendum morbi non quam nec
06/15/2017,6869,eget tempus vel pede morbi porttitor lorem id ligula suspendisse ornare consequat lectus in
04/30/2016,9641,sem praesent id massa id nisl venenatis lacinia aenean sit amet justo morbi ut odio cras mi pede malesuada in
09/17/2020,5713,nonummy integer non velit donec diam neque vestibulum eget vulputate
11/20/2015,1684,eu tincidunt in leo maecenas pulvinar lobortis est phasellus sit amet erat nulla tempus vivamus in felis eu sapien
08/27/2018,5123,ante ipsum primis in faucibus orci luctus et ultrices posuere cubilia curae
04/01/2020,4985,bibendum morbi non quam nec dui luctus rutrum nulla tellus in sagittis dui vel nisl duis
05/23/2016,5037,faucibus orci luctus et ultrices posuere cubilia curae nulla dapibus dolor vel est donec odio justo sollicitudin ut
11/12/2019,2620,cubilia curae nulla dapibus dolor vel est donec odio justo sollicitudin ut suscipit a feugiat
06/03/2016,7594,quam sollicitudin vitae consectetuer eget rutrum at lorem integer tincidunt ante vel ipsum praesent blandit lacinia erat vestibulum
04/11/2017,7200,cursus id turpis integer aliquet massa id lobortis convallis tortor risus dapibus augue vel accumsan tellus nisi eu orci mauris
01/25/2017,8559,et ultrices posuere cubilia curae mauris viverra diam vitae quam suspendisse
02/19/2020,7231,vestibulum vestibulum ante ipsum primis in faucibus orci luctus et ultrices posuere cubilia curae nulla dapibus dolor vel
10/01/2021,1190,duis bibendum morbi non quam nec dui luctus rutrum nulla tellus in sagittis dui vel nisl duis
04/20/2021,8985,libero nullam sit amet turpis elementum ligula vehicula consequat morbi a ipsum integer a nibh in quis justo maecenas
07/19/2019,5511,ac est lacinia nisi venenatis tristique fusce congue diam id ornare imperdiet sapien urna pretium nisl ut volutpat sapien
02/18/2016,2913,mus vivamus vestibulum sagittis sapien cum sociis natoque penatibus et magnis dis parturient montes nascetur ridiculus mus etiam vel
01/23/2016,9217,nulla nunc purus phasellus in felis donec semper sapien a libero nam dui
03/13/2020,4821,felis donec semper sapien a libero nam dui proin leo odio porttitor
06/06/2015,6004,volutpat erat quisque erat eros viverra eget congue eget semper rutrum nulla nunc purus
05/27/2018,3160,ultrices posuere cubilia curae mauris viverra diam vitae quam suspendisse potenti nullam porttitor lacus
03/04/2019,3465,ac tellus semper interdum mauris ullamcorper purus sit amet nulla quisque arcu libero rutrum
06/05/2019,5444,lorem integer tincidunt ante vel ipsum praesent blandit lacinia erat vestibulum
08/27/2015,2354,nunc commodo placerat praesent blandit nam nulla integer pede justo lacinia
12/27/2021,9781,lacus at velit vivamus vel nulla eget eros elementum pellentesque quisque porta volutpat
09/01/2019,5531,at nulla suspendisse potenti cras in purus eu magna vulputate luctus cum sociis
05/23/2015,583,odio curabitur convallis duis consequat dui nec nisi volutpat eleifend donec
01/12/2019,2729,sem duis aliquam convallis nunc proin at turpis a pede posuere nonummy integer non velit donec diam neque vestibulum
10/07/2018,4287,odio condimentum id luctus nec molestie sed justo pellentesque viverra pede ac diam
04/25/2017,3540,pellentesque ultrices phasellus id sapien in sapien iaculis congue vivamus metus arcu adipiscing molestie hendrerit at vulputate
08/22/2016,5908,natoque penatibus et magnis dis parturient montes nascetur ridiculus mus etiam vel augue vestibulum rutrum rutrum
06/06/2016,2468,eleifend quam a odio in hac habitasse platea dictumst maecenas ut massa quis augue luctus tincidunt
07/25/2019,5162,vulputate vitae nisl aenean lectus pellentesque eget nunc donec quis orci eget
09/13/2015,3848,eget vulputate ut ultrices vel augue vestibulum ante ipsum primis
07/02/2021,1737,pede ullamcorper augue a suscipit nulla elit ac nulla sed vel enim sit amet nunc
08/29/2019,6138,eu tincidunt in leo maecenas pulvinar lobortis est phasellus sit amet erat nulla tempus
10/07/2019,5124,pellentesque ultrices mattis odio donec vitae nisi nam ultrices libero non mattis pulvinar nulla pede ullamcorper augue a suscipit nulla
07/18/2016,2606,tortor id nulla ultrices aliquet maecenas leo odio condimentum id luctus nec molestie sed
11/17/2018,1434,magna vulputate luctus cum sociis natoque penatibus et magnis dis parturient montes nascetur ridiculus
07/23/2017,3397,turpis nec euismod scelerisque quam turpis adipiscing lorem vitae mattis nibh ligula nec
